anime_id,name,genre,type,episodes,rating,members
5996,Kunoichi Sakuya,Hentai,OVA,2,5.89,1218
5997,Mai no Mahou to Katei no Hi,"Drama, Magic",Special,1,6.09,1131
5998,Tiger &amp; Bunny,"Action, Comedy, Mystery, Super Power",TV,25,8.12,104075
5999,Ore-sama Kingdom,"Romance, Shoujo",OVA,14,6.61,1846
6000,Hime Gal♥Paradise,Shoujo,OVA,9,6.21,563
6001,Lan Mao,"Adventure, Comedy",TV,Unknown,6.04,177
6002,Music Up,Music,TV,52,6.23,147
6003,The Olympic Adventures of Fuwa,Comedy,TV,100,6.17,76
6004,Hulu Xiongdi,"Action, Super Power",TV,13,7.4,170
6005,Jiu Se Lu,Supernatural,Movie,1,6.26,775
6006,Wei Qi Shao Nian,"Game, Historical",TV,26,6.4,196
6007,Big Mouth Do Do,"Kids, Slice of Life",TV,52,6.54,115
6008,The Primitives: Bongo and Grunge,Comedy,TV,52,5.5,58
6009,Hoshizora no Violin,"Historical, Slice of Life",Movie,1,6.87,482
6010,Hayate no Gotoku! Heaven Is a Place on Earth,"Comedy, Harem, Parody",Movie,1,7.26,22973
6011,Raiyantsuuri no Uta,"Drama, Historical",Movie,1,7.51,465
6012,Detective Conan Movie 15: Quarter of Silence,"Adventure, Comedy, Mystery, Police, Shounen",Movie,1,8.13,17165
6013,Soukou Kyojin Z-Knight,Mecha,OVA,1,5.13,110
6014,W: Wish Omake,"Harem, School, Seinen",Special,4,5.54,802
6015,Wana: Hakudaku Mamire no Houkago,Hentai,OVA,2,6.62,2887
6016,Gintama&#039;,"Action, Comedy, Historical, Parody, Samurai, Sci-Fi, Shounen",TV,51,9.16,151266
6017,Floating Material,Hentai,OVA,2,6.77,4567
6018,Document Taiyou no Kiba Dagram,"Drama, Mecha, Military, Sci-Fi, Shounen",Movie,1,6.32,336
6019,Xi Yang Yang Yu Hui Tai Lang: Zhi Hu Hu Sheng Wei,"Adventure, Comedy, Kids",Movie,1,5.26,143
6020,Wakaranai Buta,Drama,Movie,1,4.92,333
6021,Kyouryuu Tankentai Born Free,"Action, Sci-Fi",TV,25,6.12,236
6022,Precure All Stars Movie DX3: Mirai ni Todoke! Sekai wo Tsunagu☆Nijiiro no Hana,"Action, Fantasy, Magic, Shoujo",Movie,1,7.61,2842
6023,Phi Brain: Kami no Puzzle,"Action, Game, Mystery, Shounen",TV,25,7.32,64958
6024,Fairy Tail OVA,"Comedy, Ecchi, Fantasy, Magic, Shounen",OVA,5,7.83,83421
6025,Otome wa Boku ni Koishiteru: Futari no Elder,"Drama, Romance, School",OVA,3,6.96,10579
6026,Ano Hi Mita Hana no Namae wo Bokutachi wa Mada Shiranai.,"Drama, Slice of Life, Supernatural",TV,11,8.62,463835
6027,Midori-ko,"Dementia, Drama",Movie,1,6.46,609
6028,Bremen 4: Jigoku no Naka no Tenshi-tachi,"Adventure, Kids",Special,1,6.29,249
6029,Samuraider: Nazo no Tenkousei,"Action, Drama, Samurai",OVA,1,5.82,212
6030,Hyouge Mono,"Historical, Samurai, Seinen",TV,39,8.1,10649
6031,Chuuhai Lemon: Love 30s - Ame ni Nurete mo,"Comedy, Drama, Police, Romance",OVA,1,6.05,116
6032,One Piece 3D: Mugiwara Chase,"Action, Adventure, Comedy, Fantasy, Shounen",Movie,1,7.34,23772
6033,Esper Mami Special: My Angel Mami-chan,"Comedy, Super Power, Supernatural",Special,1,6.52,148
6034,Kago Shintarou Anime Sakuhin Shuu,"Comedy, Dementia, Horror, Seinen",OVA,15,5.23,1551
6035,Tetsujin 28-gou: Hakuchuu no Zangetsu,"Action, Adventure, Mecha, Sci-Fi",Movie,1,6.77,404
6036,Carnival Phantasm,"Comedy, Parody, Supernatural",OVA,12,8.01,71976
6037,Shouwa Monogatari (Movie),"Drama, Historical",Movie,1,6.49,878
6038,Shouwa Monogatari,"Drama, Historical",TV,13,7.06,3563
6039,Yu☆Gi☆Oh! Zexal,"Action, Fantasy, Game, Shounen",TV,73,6.58,22480
6040,Kizuna Ichigeki,"Comedy, Martial Arts",Movie,1,6.68,4128
6041,Dragon Ball: Super Saiya-jin Zetsumetsu Keikaku,"Adventure, Fantasy, Martial Arts, Sci-Fi, Shounen, Super Power",OVA,1,7.07,15280
6042,Ore no Imouto ga Konnani Kawaii Wake ga Nai Specials,"Comedy, Seinen, Slice of Life",ONA,4,7.66,101495
6043,Magic Knight Rayearth Omake,"Adventure, Comedy, Drama, Fantasy, Magic, Mecha, Romance, Shoujo",Special,5,6.45,1730
6044,Coquelicot-zaka kara,"Historical, Romance, School, Shoujo",Movie,1,8.03,50689
6045,Bakuman. 2nd Season,"Comedy, Drama, Romance, Shounen",TV,25,8.53,151561
6046,Toriko,"Action, Adventure, Comedy, Fantasy, Shounen",TV,147,7.74,54790
6047,Boku no Chikyuu wo Mamotte: Kiniro no Toki Nasarete,"Drama, Music, Romance, Sci-Fi, Shoujo",Special,1,6.85,610
6048,Chinpui Specials,Comedy,Special,2,5.7,87
6049,Chinpui: Eri-sama Katsudou Daishashin,Comedy,Movie,1,6,107
6050,Sailor Fuku Shinryou Tsumaka,Hentai,OVA,2,6.2,1442
6051,Brave Fire S0.9,"Mecha, Sci-Fi",Special,1,5.88,144
6052,Seishun Fuufu Monogatari: Koiko no Mainichi,"Comedy, Drama, Ecchi, Romance, Seinen",OVA,2,6.22,162
6053,Fuyu no Semi: Tokubetsu Henshuuhan,"Action, Drama, Historical, Military, Samurai, Yaoi",OVA,1,7.44,2322
6054,Nurarihyon no Mago: Sennen Makyou,"Action, Demons, Shounen, Supernatural",TV,24,8.15,75612
6055,Macross F Music Clip Shuu: Nyankuri,Music,Music,1,7.47,3010
6056,Black Jack: Heian Sento,Shounen,Movie,1,6.61,1087
6057,Sore Ike! Anpanman: Kyouryuu Nosshii no Daibouken,"Comedy, Fantasy, Kids",Movie,1,5.61,113
6058,Sore Ike! Anpanman: Tobe! Tobe! Chibigon,"Comedy, Fantasy, Kids",Movie,1,5.54,113
6059,Sore Ike! Anpanman: Yuurei Sen wo Yattsukero!!,"Comedy, Fantasy, Kids",Movie,1,6.43,117
6060,Sore Ike! Anpanman: Tsumiki Shiro no Himitsu,"Comedy, Fantasy, Kids",Movie,1,6.73,130
6061,Sore Ike! Anpanman: Sora Tobu Ehon to Glass no Kutsu,"Comedy, Fantasy, Kids",Movie,1,5.93,115
6062,Sore Ike! Anpanman: Baikinman no Gyakushuu,"Comedy, Fantasy, Kids",Movie,1,5.89,124
6063,Angel Beats!: Another Epilogue,"Drama, School, Supernatural",Special,1,7.63,134180
6064,Seikon no Qwaser II,"Action, Ecchi, Seinen, Super Power, Supernatural",TV,12,6.69,64168
6065,Toriko 3D: Kaimaku Gourmet Adventure!!,"Action, Adventure, Comedy, Shounen",Movie,1,6.83,4204
6066,Naruto x UT,"Action, Comedy, Martial Arts, Shounen, Super Power",OVA,1,7.58,23465
6067,Kämpfer für die Liebe,"Action, Comedy, Ecchi, Shoujo Ai, Super Power",Special,2,6.69,37047
6068,Sango no Umi to Ouji,Fantasy,OVA,1,6.16,132
6069,Hoshizora e Kakaru Hashi,"Comedy, Ecchi, Harem, Romance, School",TV,12,7.04,85178
6070,Kami nomi zo Shiru Sekai II,"Comedy, Harem, Romance, Shounen, Supernatural",TV,12,8.12,194300
6071,Shiki Specials,"Horror, Mystery, Supernatural, Vampire",Special,2,7.93,37657
6072,Fate/Zero,"Action, Fantasy, Supernatural",TV,13,8.51,453630
6073,Ghost in the Shell: Stand Alone Complex - Solid State Society 3D,"Mecha, Military, Mystery, Police, Sci-Fi, Seinen",Movie,1,7.91,7515
6074,Break Blade 6: Doukoku no Toride,"Action, Mecha, Military, Shounen",Movie,1,7.82,39077
6075,Kobato.: Hajimete no Kobato.,"Comedy, Drama, Fantasy",Special,8,6.88,6001
6076,Shoujo Senki Brain Jacker,"Hentai, Supernatural",OVA,2,5.76,1976
6077,Loups=Garous Picture Drama,"Mystery, Sci-Fi",Special,1,5.55,1041
6078,Bavi Stock,"Action, Adventure, Fantasy, Sci-Fi",OVA,2,5.6,357
6079,Sweet Home: H na Oneesan wa Suki Desu ka?,"Harem, Hentai",OVA,3,7.1,4175
6080,Ore no Imouto ga Konnani Kawaii Wake ga Nai: SD Chara ni Yoru Character Commentary,Comedy,Special,16,7.16,14917
6081,Softenni,"Comedy, Ecchi, School, Sports",TV,12,6.6,16068
6082,Mayo Chiki!,"Comedy, Ecchi, Harem, Romance, School",TV,13,7.53,192219
6083,Alexandros no Ketsudan,Historical,OVA,1,5.48,212
6084,Yokohama Meibutsu: Otoko Katayama-gumi!,"Action, School, Shounen",OVA,2,6.53,150
6085,Nintama Rantarou Movie: Ninjutsu Gakuen Zenin Shutsudou! no Dan,"Comedy, Shounen",Movie,1,6.85,297
6086,Friends: Mononoke Shima no Naki,"Comedy, Fantasy, Kids",Movie,1,7.19,601
6087,Crayon Shin-chan Movie 19: Arashi wo Yobu Ougon no Spy Daisakusen,Comedy,Movie,1,7.02,795
6088,Ginga Tetsudou 999: Jikuu wo Koeta Energy no Tabi,"Adventure, Drama, Sci-Fi",ONA,5,6.67,378
6089,Seitokai Yakuindomo OVA,"Comedy, School, Shounen, Slice of Life",OVA,8,7.89,63265
6090,Kowarekake no Orgel Special,"Drama, Music, Sci-Fi, Seinen, Slice of Life",Special,1,7.04,7198
6091,Jin Sheng Yuan,Music,Music,1,6.38,406
6092,Manga Hajimete Monogatari,"Adventure, Comedy, Historical",TV,305,6.36,169
6093,Manga Doushite Monogatari,"Adventure, Comedy, Kids",TV,100,6.67,140
6094,Manga Naruhodo Monogatari,"Adventure, Kids",TV,102,6.74,115
6095,Manga Hajimete Omoshiro Juku,"Adventure, Kids",TV,110,6.68,162
6096,21 Seiki Manga Hajimete Monogatari,"Adventure, Comedy, Kids, Sci-Fi",Special,1,6.63,258
6097,Mo fa a ma,"Adventure, Fantasy",Movie,1,6.18,124
6098,Kimi ni Todoke 2nd Season: Kataomoi,"Romance, Shoujo",Special,1,7.27,35243
6099,Mahou Shoujo Lyrical Nanoha: The Movie 2nd A&#039;s,"Action, Comedy, Drama, Magic, Super Power",Movie,1,8.34,13315
6100,Dog Days,"Action, Adventure, Fantasy, Magic",TV,13,7.21,97809
6101,Sacred Seven,"Action, School, Sci-Fi, Super Power",TV,12,6.74,47136
6102,No.6,"Action, Sci-Fi",TV,11,7.76,168017
6103,Usagi Drop,"Josei, Slice of Life",TV,11,8.56,194855
6104,C: The Money of Soul and Possibility Control,"Action, Mystery, Super Power, Thriller",TV,11,7.44,156853
6105,Nichijou,"Comedy, School, Slice of Life",TV,26,8.52,254436
6106,Freezing Specials,"Action, Comedy, Ecchi",Special,6,6.74,28125
6107,DD Hokuto no Ken,"Parody, Seinen",TV,12,6.28,2348
6108,Otona Joshi no Anime Time,"Drama, Josei, Slice of Life",Special,4,7.52,11268
6109,Otome Youkai Zakuro Picture Drama,"Demons, Historical, Romance, Seinen, Supernatural",Special,2,6.45,2747
6110,HenSemi (TV),"Comedy, Ecchi, Seinen",TV,13,6.66,27878
6111,Hunter x Hunter Pilot,"Action, Adventure, Shounen, Super Power",OVA,1,7.37,10375
6112,Katte ni Kaizou,"Comedy, Parody, School, Sci-Fi, Shounen",OVA,6,7.06,19904
6113,Badaui Jeonseol Jangbogo,"Action, Adventure, Comedy, Mystery",TV,26,6.35,371
6114,Baby Princess 3D Paradise 0 [Love],"Ecchi, Harem, Seinen",OVA,1,6.63,17570
6115,Nyanpire The Animation,"Comedy, Supernatural",TV,12,6.83,19161
6116,Super Doll Licca-chan: Licca-chan Zettai Zetsumei! Doll Knights no Kiseki,"Action, Adventure, Fantasy, Kids, Magic, Shoujo, Super Power",Movie,1,6.23,295
6117,Bikkuriman: Moen Zone no Himitsu,"Action, Adventure, Kids",Movie,1,5.42,108
6118,Senkou no Night Raid Picture Drama,"Action, Historical, Super Power",Special,1,6.28,1543
6119,Kamen Rider Den-O: Imagin Anime 3,"Action, Adventure, Comedy, Kids, Super Power",OVA,12,6.58,350
6120,Bikkuriman: Daiichiji Seima Taisen,"Action, Adventure, Kids",Movie,1,5.71,109
6121,Lily to Kaeru to (Otouto),"Adventure, Comedy, Supernatural",Special,1,6.53,760
6122,Kore wa Zombie Desu ka? OVA,"Action, Comedy, Ecchi, Harem, Magic, Supernatural",OVA,2,7.57,73826
6123,Bug tte Honey,"Adventure, Comedy",TV,51,6.3,146
6124,Maji de Watashi ni Koi Shinasai!,"Comedy, Ecchi, Harem, Martial Arts, Romance, School, Super Power",TV,12,7.02,116683
6125,"Yondemasu yo, Azazel-san. (TV)","Comedy, Demons, Supernatural",TV,13,7.64,42147
6126,Kaitou Tenshi Twin Angel: Kyun Kyun☆Tokimeki Paradise!!,Magic,TV,12,6.03,4669
6127,Berserk: Ougon Jidai-hen I - Haou no Tamago,"Action, Adventure, Demons, Fantasy, Military, Seinen, Supernatural",Movie,1,7.91,77103
6128,Oniichan no Koto nanka Zenzen Suki ja Nai n da kara ne!! Special,"Comedy, Ecchi, Romance",Special,1,6.46,10024
6129,Uchuu Majin Daikengou,"Action, Adventure, Mecha, Sci-Fi, Shounen, Space",TV,26,6.6,229
6130,Tamayura: Hitotose,"Comedy, Drama, Slice of Life",TV,12,7.32,25760
6131,Kagee Grimm Douwa,"Adventure, Demons, Drama, Fantasy, Historical, Kids, Magic, Romance, Supernatural",TV,52,5.94,129
6132,Ki-Fighter Taerang,"Adventure, Kids",TV,26,5.92,81
6133,Hybrid Deka,Comedy,Movie,1,5,94
6134,Mayutoro The Toons,"Comedy, Fantasy, Kids",TV,33,5.38,76
6135,Sekai Monoshiri Ryoko,Comedy,TV,1006,5.92,153
6136,Ton-Ton Atta to Niigata no Mukashibanashi,Comedy,TV,13,6.54,63
6137,Ultra B: Black Hole kara no Dokusaisha BB!!,"Adventure, Comedy",Movie,1,5.54,71
6138,Burning Village,"Fantasy, Horror",OVA,10,5.83,108
6139,Hajimete no Christmas,Kids,Special,1,6.3,89
6140,Jankenman: Kaijuu Dai Kessen,"Comedy, Kids",OVA,1,6.31,80
6141,Toaru Majutsu no Index-tan II,"Comedy, Parody",Special,2,7.14,20942
6142,Ultra B,"Comedy, Super Power",TV,119,5.52,102
6143,Shion Special,Hentai,Special,1,6.58,860
6144,Pretty Rhythm: Aurora Dream,"Music, Shoujo, Slice of Life, Sports",TV,51,7.6,9431
6145,Gokicha!!,Comedy,ONA,2,5.66,5615
6146,Da Yu Hai Tang,"Adventure, Supernatural",Movie,1,6.98,7639
6147,Eiyuu Densetsu: Sora no Kiseki The Animation,"Action, Adventure, Fantasy",OVA,2,6.83,9730
6148,Toufu Kozou,Comedy,Movie,1,6.15,295
6149,Gag Manga Biyori: Jump Festa 2002 Special,Comedy,Special,1,6.5,513
6150,Sonic X Pilot,"Adventure, Comedy, Kids, Mecha, Sci-Fi, Shounen",Special,2,6.29,1795
6151,Gun-dou Musashi Recap,"Adventure, Fantasy, Samurai",Special,1,4.62,227
6152,Gyakkyou Burai Kaiji: Hakairoku-hen,"Game, Psychological, Seinen, Thriller",TV,26,8.29,55566
6153,Prince of Tennis: Mini Theater,Comedy,Special,3,7.13,3010
6154,The iDOLM@STER,"Comedy, Drama, Music",TV,25,7.75,81155
6155,Uchuu Kaizoku Sara Special,"Hentai, Sci-Fi",Special,1,7.07,2441
6156,Manga Nippon Mukashibanashi,Historical,TV,12,5.95,174
6157,Manga Nippon Mukashibanashi (Movie),Historical,Movie,1,6.05,110
6158,Soukou Kijo Iris Special,"Hentai, Supernatural",Special,1,6.29,1125
6159,Towa no Quon 1: Utakata no Kaben,"Action, Super Power, Supernatural",Movie,1,7.53,33550
6160,Shin Koihime†Musou: Otome Tairan OVA,"Comedy, School",OVA,1,6.91,3709
6161,Kaichou wa Maid-sama!: Goshujinsama to Asonjao♥,"Comedy, School, Shoujo",Special,1,7.41,41241
6162,Rio: Rainbow Gate! Special,"Comedy, Ecchi, Game",Special,1,6.25,3037
6163,Pokemon Diamond &amp; Pearl Specials,"Action, Comedy, Fantasy, Kids",Special,2,7.17,5913
6164,Shin Karate Jigoku-hen,"Action, Martial Arts",OVA,2,5.87,137
6165,Umi Monogatari: Kanon to Iku Amamikoshima,Comedy,Special,13,6.46,1087
6166,Sengoku Otome: Momoiro Paradox,"Action, Comedy, Historical, Samurai, Sci-Fi, Super Power",TV,13,6.71,27080
6167,Dallos Special,Fantasy,Movie,1,5.77,301
6168,Chou Dendou Robo Tetsujin 28-gou FX,"Action, Adventure, Mecha, Sci-Fi",TV,47,6.53,354
6169,Uta no☆Prince-sama♪ Maji Love 1000%,"Comedy, Harem, Music, Romance, School, Shoujo",TV,13,7.37,105723
6170,Golden Kids,"School, Sports",ONA,2,4.61,138
6171,Tono to Issho: Gantai no Yabou,"Comedy, Historical, Parody, Samurai, Seinen",TV,12,6.73,1993
6172,Kyuuketsuki,"Hentai, Vampire",OVA,2,5.91,3281
6173,Cosplay Roshutsu Kenkyuukai,Hentai,OVA,2,6.21,2401
6174,Bakugan Battle Brawlers: Mechtanium Surge,"Action, Adventure, Fantasy, Game, Shounen",TV,46,6.29,8662
6175,Rurouni Kenshin Recap,"Action, Adventure, Comedy, Historical, Romance, Samurai",Special,1,7.46,4527
6176,Konpeki no Kantai: Sourai Kaihatsu Monogatari,"Historical, Military",Special,1,6.45,164
6177,Last Exile: Ginyoku no Fam,"Action, Adventure, Sci-Fi",TV,21,7.14,28616
6178,Honto ni Atta! Reibai Sensei,"Comedy, School, Shounen, Supernatural",TV,22,6.66,5082
6179,Tetsuwan Atom: Uchuu no Yuusha,"Action, Adventure, Drama, Mecha, Sci-Fi, Shounen",Movie,1,6.51,661
6180,Ring ni Kakero 1: Sekai Taikai-hen,Sports,TV,6,6.96,566
6181,Happy Kappy,"Comedy, Fantasy, Shoujo",TV,25,5.64,792
6182,Fireball Charming,Sci-Fi,TV,13,6.94,5640
6183,Suzy&#039;s Zoo: Daisuki! Witzy,Kids,TV,25,6.35,369
6184,Hakuouki Sekkaroku,"Action, Demons, Drama, Fantasy, Historical, Josei",OVA,6,7.84,14725
6185,Tenchi Muyou! Ryououki 2nd Season Picture Drama,"Comedy, Sci-Fi, Shounen, Space",Special,1,7.18,3626
6186,Okama Hakusho,"Comedy, Seinen",OVA,3,5.67,183
6187,Kakomareta Sekai,Drama,ONA,1,6.22,786
6188,Twinkle Heart: Gingakei made Todokanai,"Adventure, Comedy, Space",OVA,1,5.63,307
6189,Jinrui wa Suitai Shimashita,"Comedy, Fantasy, Seinen",TV,12,7.92,89373
6190,Jewelpet Sunshine,"Fantasy, Magic, Shoujo",TV,52,6.86,2019
6191,Kinniku Banzuke: Kongou-kun no Daibouken!,"Action, Shounen, Sports",TV,3,5.63,192
6192,Macross F: Choujikuu Gekijou,"Comedy, Slice of Life",OVA,1,6.72,2177
6193,Teleclub no Himitsu,Hentai,OVA,2,4.67,148
6194,Shougeki Shinsengumi,"Comedy, Historical",OVA,1,6.26,84
6195,Metal Fight Beyblade 4D,"Adventure, Sports",TV,52,6.93,5894
6196,Kamisama Dolls,"Action, Seinen, Supernatural",TV,13,7.14,47665
6197,Soul Link Picture Drama,"Romance, Sci-Fi",Special,3,5.84,603
6198,Denshinbashira no Okaasan,Drama,Movie,1,5.82,224
6199,Shinryaku!? Ika Musume,"Comedy, Shounen, Slice of Life",TV,12,7.62,45613
6200,Natsume Yuujinchou San,"Drama, Fantasy, Shoujo, Slice of Life, Supernatural",TV,13,8.67,102322
6201,Oni Chichi: Re-birth,Hentai,OVA,1,7.65,14925
6202,Sono Hanabira ni Kuchizuke wo: Reo x Mai Diaries,"Comedy, Romance, School, Shoujo Ai",ONA,10,6.66,5125
6203,Momo e no Tegami,"Drama, Supernatural",Movie,1,7.78,30519
6204,.hack//Quantum: Sore ike! Bokura no Chimuchimu-chan!!,"Comedy, Game",Special,3,6.73,5249
6205,Kuragehime: Soreike! Amars Tankentai,"Adventure, Comedy, Josei",Special,6,5.77,6115
6206,Pet Life,Hentai,OVA,1,6.43,2374
6207,Ben-To,"Action, Comedy, Martial Arts",TV,12,7.49,146570
6208,Mashiro-iro Symphony: The Color of Lovers,"Drama, Harem, Romance, School",TV,12,7.3,77284
6209,Xi Avant,"Adventure, Sci-Fi",Movie,1,6.41,2379
6210,Spelunker Sensei,Comedy,OVA,1,5.18,1976
6211,Shimanchu MiRiKa,Slice of Life,Special,1,5.72,267
6212,Hotarubi no Mori e,"Drama, Romance, Shoujo, Supernatural",Movie,1,8.61,197439
6213,Kyouhaku: Owaranai Ashita - Special Stage,Hentai,Special,1,5.68,395
6214,Gyo,Horror,OVA,1,5.71,27005
6215,Deadman Wonderland OVA,"Action, Horror, Sci-Fi",OVA,1,7.12,78878
6216,Menkui!,Hentai,OVA,2,7.24,4954
6217,Gakuen 3,Hentai,OVA,2,6.63,2188
6218,Bi-chiku Beach: Nangoku Nyuujoku Satsueikai,Hentai,OVA,1,6.51,2863
6219,Ona x2,Hentai,OVA,1,5.65,946
6220,Otoko no Ko Ojousama,Hentai,OVA,1,6.22,1572
6221,Baka to Test to Shoukanjuu: Matsuri - Sentaku ni Yotte Tenkai ga Kawaru &quot;LIPS Eizou&quot;,"Comedy, Parody",ONA,1,7.03,18934
6222,Boyfriend,"Romance, Shoujo, Sports",Special,1,5.68,243
6223,Animal Dance,"Dementia, Music",Movie,1,4.98,412
6224,Digimon Xros Wars: Aku no Death General to Nanatsu no Oukoku,"Action, Adventure, Comedy, Fantasy, Shounen",TV,24,7.42,12505
6225,Perfect Day,Music,Music,1,7.59,7743
6226,Aquarion Evol,"Action, Comedy, Drama, Fantasy, Mecha, Romance, Sci-Fi",TV,26,7.32,62753
6227,Rain Town,Drama,ONA,1,7.38,12489
6228,Kyoukaisenjou no Horizon,"Action, Fantasy",TV,13,7.29,90977
6229,JK to Inkou Kyoushi 4,Hentai,OVA,2,6.82,3914
6230,Ran-&gt;Sem: Hakudaku Delmo Tsuma no Miira Tori,Hentai,OVA,2,6.92,4192
6231,Puu-Neko,Comedy,TV,11,5.49,496
6232,Kimi to Boku.,"Comedy, Drama, Romance, School, Shounen, Slice of Life",TV,13,7.85,86196
6233,Exper Zenon,"Action, Sci-Fi",Movie,1,5.78,623
6234,Seitokai no Ichizon Lv.2,"Comedy, Harem, Parody, School",ONA,10,7.48,41169
6235,Manyuu Hikenchou,"Action, Comedy, Ecchi, Samurai, Seinen",TV,12,6.34,32171
6236,Phantom Yuusha Densetsu,"Action, Drama, Military, Seinen",OVA,1,5.44,176
6237,Sayonara Zetsubou Sensei Special,"Comedy, Mystery, Parody",Special,1,7.63,9669
6238,God Eater Prologue,"Action, Fantasy, Military, Sci-Fi",Special,1,6.8,19414
6239,Ie Naki Ko Remi Specials,"Adventure, Drama",Special,3,7.72,781
6240,Haiyoru! Nyaruani: Remember My Love(craft-sensei) Special,"Comedy, Sci-Fi",Special,1,6.26,8434
6241,Beelzebub Specials,"Action, Comedy, Demons, School, Shounen, Supernatural",Special,16,7.44,9834
6242,Otohime Connection,"Drama, Mystery, Romance, Shoujo, Slice of Life",OVA,1,6.27,259
6243,"Sengoku Basara Two: Ryuko, Itadaki no Chikai! Atsuki Mirai e Kakeru Tamashii!!","Action, Historical, Samurai",Special,1,7.47,4955
6244,Shocking Pink!,"Harem, Hentai",OVA,2,7,3877
6245,Blood-C,"Action, Horror, School, Supernatural, Vampire",TV,12,6.73,118553
6246,Higurashi no Naku Koro ni Kira,"Mystery, Parody",OVA,4,6.58,46712
6247,Yuru Yuri,"Comedy, School, Shoujo Ai, Slice of Life",TV,12,7.7,148140
6248,Hetalia World Series Specials,"Comedy, Historical, Parody",Special,4,7.88,14348
6249,Ojiisan no Lamp,"Drama, Historical",Movie,1,7.71,11745
6250,Bannou Yasai Ninninman,"Comedy, Supernatural",Movie,1,6.13,3612
6251,Tansu Warashi.,"Comedy, Slice of Life, Supernatural",Movie,1,6.91,4028
6252,Gosick Recap,"Historical, Mystery, Shounen",Special,1,7.11,8792
6253,Shiawase Haitatsu Taneko,Comedy,TV,Unknown,6.5,152
6254,Inazuma Eleven Go,"Shounen, Sports, Super Power",TV,47,7.32,18480
6255,Hoero! Bun Bun (Movie),Kids,Movie,1,6.28,120
6256,Toyama Kankou Anime Project,"Historical, Slice of Life",Special,6,5.59,580
6257,Usavich IV,Comedy,TV,13,6.93,1660
6258,Anemone,"Drama, Magic, Supernatural",OVA,1,6.69,2466
6259,Mahou Shoujo Sonico★Magica,"Music, Parody",ONA,1,5.98,13266
6260,Nurse Witch Komugi-chan Magikarte Z Special,"Comedy, Parody",Special,1,5.8,1227
6261,Working&#039;!!,"Comedy, Slice of Life",TV,13,7.98,117328
6262,Duel Masters Victory,"Action, Adventure, Comedy, Shounen",TV,52,6.37,574
6263,Shinseiki Duel Masters Flash,"Comedy, Kids",TV,24,6.27,314
6264,Duel Masters Zero,"Action, Kids",TV,25,6.4,795
6265,Duel Masters Cross,"Action, Adventure, Comedy, Shounen",TV,100,6.72,1062
6266,Duel Masters Cross Shock,"Action, Adventure, Comedy, Shounen",TV,50,6.5,920
6267,Detective Conan Magic File 5: Niigata - Tokyo Omiyage Capriccio,"Adventure, Comedy, Mystery, Police, Shounen",OVA,1,7.47,5369
6268,Working&#039;!! Announcement Specials,Comedy,ONA,2,6.84,8973
6269,Fujilog,Comedy,TV,13,5.75,275
6270,Doraemon Movie 31: Shin Nobita to Tetsujin Heidan - Habatake Tenshi-tachi,"Adventure, Comedy, Fantasy, Kids, Shounen",Movie,1,7.73,1317
6271,Kimi ni Todoke 2nd Season Specials,"Comedy, Romance, Shoujo",Special,3,7.42,23498
6272,Hato no Oyome-san,Comedy,TV,22,3.62,168
6273,Genki!! Ekoda-chan,Comedy,TV,22,5.5,189
6274,Shuukan Shimakou,Comedy,TV,11,5.32,251
6275,The Epic Of ZektBach,"Action, Fantasy, Supernatural",OVA,1,6,2792
6276,Rinkan Club,Hentai,OVA,4,6.63,3107
6277,Oretachi ni Tsubasa wa Nai: Hadairo Ritsu Kyuuwari Zou!?,"Drama, Ecchi, Fantasy, Harem, Romance",OVA,1,6.52,8216
6278,Precure All Stars GoGo Dream Live!,"Action, Fantasy, Magic, Shoujo",Special,1,6.98,1642
6279,Akebi no Hana: Maho,Hentai,OVA,1,5.77,1922
6280,Betsu ni Anta no Tame ni Ookiku Nattan Janain Dakara ne!!,Hentai,OVA,1,6.31,3516
6281,Yakyuukyou no Uta,"Action, Drama, Sports",TV,25,7.15,292
6282,Machine Hayabusa,"Action, Cars, Shounen, Sports",TV,21,6.36,227
6283,Yakyuukyou no Uta: Kita no Ookami Minami no Tora,"Action, Drama, Sports",Movie,1,6.35,112
6284,Korogashi Ryouta,"Action, Comedy, Seinen",OVA,3,5.9,96
6285,Kamisama no Memochou,Mystery,TV,12,7.7,130502
6286,Inshitsu Otaku ni Ikareru Kanojo,Hentai,OVA,3,6.21,2730
6287,Ro-Kyu-Bu!,"Comedy, Ecchi, School, Sports",TV,12,7.05,46940
6288,Prince of Tennis: Another Story II - Ano Toki no Bokura,"Shounen, Sports",OVA,4,7.71,6005
6289,Naisho no Wakana-san,Hentai,OVA,1,5.96,1478
6290,C³,"Action, Comedy, Ecchi, School, Supernatural",TV,12,6.88,100425
6291,Mobile Suit Gundam 0083: Stardust Memory - The Mayfly of Space,"Action, Drama, Mecha, Military, Sci-Fi, Space",Special,1,6.24,3528
6292,Astarotte no Omocha! EX,"Comedy, Demons, Ecchi, Fantasy, Romance, Seinen",OVA,1,6.83,20824
6293,Mononoke Dance,"Dementia, Music",Music,1,5.19,568
6294,Chuunen Punk,Music,Music,1,4.68,308
6295,Cafe de Oni,Music,Music,1,4.4,381
6296,Persona 4 the Animation,"Adventure, Mystery, School, Sci-Fi, Super Power, Supernatural",TV,25,7.68,134942
6297,Naruto: Shippuuden Movie 5 - Blood Prison,"Action, Adventure, Martial Arts, Mystery, Shounen, Super Power",Movie,1,7.62,75660
6298,Reunion,"Harem, Hentai",OVA,2,6.79,3965
6299,Scryed Alteration I: Tao,"Action, Adventure, Sci-Fi, Shounen, Super Power",Movie,1,7.13,3108
6300,Tokimeki Tonight Recaps,"Comedy, Fantasy, Romance, Shoujo, Vampire",Special,2,6.4,220
6301,VitaminX Addiction,"Romance, School",OVA,3,6.56,1428
6302,Hayabusa: Back to the Earth - Kikan,Historical,Movie,1,4.3,119
6303,Hayabusa: Back to the Earth,Historical,Movie,1,5.8,125
6304,Hidan no Aria Special,"Action, Comedy, Mystery, Romance",Special,1,6.98,32988
6305,Rerere no Tensai Bakabon,Comedy,TV,24,6.64,182
6306,R-15,"Comedy, Ecchi, Harem, Romance, School",TV,12,6.7,53617
6307,Mirai Nikki (TV),"Action, Mystery, Psychological, Shounen, Supernatural, Thriller",TV,26,8.07,657190
6308,Tengen Toppa Gurren Lagann: Ore no Gurren wa Pikka-Pika!!,"Action, Adventure, Comedy, Mecha, Sci-Fi",OVA,1,6.95,17209
6309,Hayan Ma-eum Baeggu,Adventure,TV,13,7.06,359
6310,Mardock Scramble: The Second Combustion,"Action, Psychological, Sci-Fi",Movie,1,7.5,23866
6311,Ski Jumping Pairs: Road to Torino 2006,"Comedy, Sports",Movie,1,5.03,187
6312,Mahou Sensei Negima! Mou Hitotsu no Sekai Extra: Mahou Shoujo Yue,"Action, Adventure, Ecchi, Fantasy, Magic, School, Shounen",OVA,1,7.46,5091
6313,Tibet Inu Monogatari,Adventure,Movie,1,7.49,2647
6314,Shiodome Cable TV,Comedy,TV,22,5.35,114
6315,Denpa Onna to Seishun Otoko Special,"Comedy, Sci-Fi, Seinen",Special,1,7.41,34723
6316,Deva Zan,"Action, Fantasy",Special,1,5.28,1547
6317,Gintama: Dai Hanseikai,"Action, Comedy, Parody, Samurai",Special,1,8.19,14728
6318,Ao no Exorcist: Ura Ex,"Action, Fantasy, Shounen, Supernatural",Special,10,7.26,43615
6319,Mars,"Action, Mecha, Sci-Fi, Shounen",OVA,2,6,183
6320,Running Boy: Star Soldier no Himitsu,"Sci-Fi, Space",Movie,1,5.64,96
6321,Naruto Soyokazeden Movie: Naruto to Mashin to Mitsu no Onegai Dattebayo!!,"Action, Comedy, Martial Arts, Shounen, Super Power",Movie,1,7.11,25174
6322,Fireball Special,"Comedy, Sci-Fi",Special,1,6.44,1439
6323,Imouto Paradise!,Hentai,OVA,2,6.83,7713
6324,Morita-san wa Mukuchi.,"Comedy, School, Slice of Life",TV,13,6.63,15046
6325,Omake,Comedy,Movie,1,5.45,339
6326,Maria†Holic: Run Run Riru Ran Ran Rara,"Comedy, Music",Music,1,6.06,2778
6327,Blood-C: The Last Dark,"Action, Horror, Supernatural, Vampire",Movie,1,7.33,37925
6328,Tentacle and Witches,"Hentai, Magic, Supernatural",OVA,4,7.24,6420
6329,Sore Ike! Anpanman: Sukue! Kokorin to Kiseki no Hoshi,"Comedy, Fantasy, Kids",Movie,1,5.14,107
6330,Sore Ike! Anpanman: Utatte Teasobi! Anpanman to Mori no Takara,"Comedy, Fantasy, Kids",Movie,1,5.39,107
