anime_id,name,genre,type,episodes,rating,members
8722,Sekai no Hikari: Shinran Shounin,Historical,OVA,6,5.75,53
8723,Kiseijuu: Sei no Kakuritsu,"Action, Drama, Horror, Psychological, Sci-Fi, Seinen",TV,24,8.59,425457
8724,Yami Shibai 2nd Season,"Dementia, Horror, Supernatural",TV,13,6.54,17379
8725,"One More Time, One More Chance","Drama, Music, Romance, Slice of Life",Music,1,7.6,5660
8726,Oniku Daisuki! Zeushi-kun,Comedy,TV,12,4.98,150
8727,Kyonyuu Kazoku Saimin,Hentai,OVA,1,6.77,2521
8728,Blade &amp; Soul,"Action, Adventure, Fantasy, Martial Arts",TV,13,6.25,72692
8729,Virtual Star 2000,Action,OVA,6,5.43,75
8730,Hangyodon no Hadaka no Ou-sama,"Fantasy, Kids",OVA,1,5.91,86
8731,Bad Badtz-Maru no Ari to Kirigirisu,"Fantasy, Kids",OVA,1,5.5,99
8732,Osaru no Monkichi no Kin no Ono Gin no Ono,Kids,OVA,1,5.05,81
8733,Pom Pom Purin no Usagi to Kame,"Fantasy, Kids",OVA,1,4.31,78
8734,Ahiru no Pekkle no Ahiru no Drakestail,"Fantasy, Kids",OVA,1,5.16,129
8735,Kero Kero Keroppi no Aladdin to Mahou no Lamp,"Fantasy, Kids",OVA,1,5.91,93
8736,Ahiru no Pekkle no Minikui Ahiru no Ko,"Fantasy, Kids",OVA,1,5.25,114
8737,Pom Pom Purin no Kitakaze to Taiyou,"Fantasy, Kids",OVA,1,5.56,74
8738,Uchuu Kyoudai: Number Zero,"Comedy, Sci-Fi, Seinen, Slice of Life, Space",Movie,1,7.22,2657
8739,Nukko.,Comedy,TV,Unknown,6.4,113
8740,Patalliro Saiyuuki! Special,"Adventure, Comedy, Fantasy, Shoujo, Shounen Ai",Special,1,5.75,183
8741,Potecco Babies (2011),Comedy,ONA,12,4.85,118
8742,Kimezou no Kimarimonku Ja Kimaranee.,Comedy,ONA,12,4.91,64
8743,Kimezou no Kimarimonku Ja Kimaranee. Featuring Sabu-Otoko,Comedy,ONA,12,5,57
8744,Ahiru no Pekkle no Sindbad no Bouken,"Adventure, Fantasy, Kids",OVA,1,5.55,146
8745,Kero Kero Keroppi no Ganbare! Keroppooz,"Fantasy, Kids, Sports",OVA,1,6,88
8746,Ahiru no Pekkle no Suieitaikai wa Oosawagi,"Fantasy, Kids",OVA,1,5.44,144
8747,Patty &amp; Jimmy no Kimikoso Superstar,"Kids, Sports",OVA,1,3.82,72
8748,Ahiru no Pekkle no Aladdin to Mahou no Lamp,"Fantasy, Kids",OVA,1,5.53,141
8749,Kero Kero Keroppi no Yowamushi-ouji no Daibouken,"Adventure, Fantasy, Kids",OVA,1,6.21,88
8750,Kero Kero Keroppi no Kero Kero House no Himitsu,"Fantasy, Kids",OVA,1,6.84,78
8751,Pochacco no Wakuwaku Birthday,"Fantasy, Kids",OVA,1,6,74
8752,Kero Kero Keroppi no Tomodachitte Ii na,Kids,OVA,1,6.31,71
8753,Ahiru no Pekkle no Hihou wo Sagase,"Adventure, Fantasy, Kids",OVA,1,4.8,103
8754,Pochacco no Ninjin Hata wa Oosawagi,"Fantasy, Kids",OVA,1,6.35,76
8755,Kero Kero Keroppi no Dai Bouken,"Adventure, Fantasy, Kids",OVA,1,6,75
8756,Santa-san to Tonakai Kuppi,"Fantasy, Kids",OVA,1,5.64,71
8757,Peeping Life: Tezuka Pro - Tatsunoko Pro Wonderland,"Comedy, Parody",OVA,10,4.88,135
8758,Peeping Life: Tezuka Pro - Tatsunoko Pro Wonderland Specials,"Comedy, Parody",Special,2,3.94,115
8759,Peeping Life: Tezuka Pro - Tatsunoko Pro Wonderland ONA,"Comedy, Parody",ONA,4,4.12,120
8760,Kero Kero Keroppi no Tomodachi ni Narou yo,"Fantasy, Kids",OVA,1,5.92,70
8761,Kero Kero Keroppi no Tomodachi wa Mahoutsukai,"Kids, Magic",OVA,1,5.73,71
8762,Kero Kero Keroppi no Bikkuri! Obakeyashiki,"Kids, Supernatural",OVA,1,5.54,76
8763,Kero Kero Keroppi no Kyouryuu ga Deta,"Fantasy, Kids",OVA,1,6.1,61
8764,Kero Kero Keroppi no Sora wo Tobetara,"Adventure, Kids",OVA,1,6.45,69
8765,Kero Kero Keroppi no Sora Tobu Yume no Fune,"Fantasy, Kids",OVA,1,6.62,67
8766,Kero Kero Keroppi no Sanjuushi,"Fantasy, Kids",Movie,1,6.3,63
8767,Kero Kero Keroppi: Hasunoue Town Kiki Ippatsu!,"Fantasy, Kids",TV,6,6.62,71
8768,Kero Kero Keroppi no Mitsubachi Daisoudou,"Fantasy, Kids",OVA,1,6.17,60
8769,Nerawareta Megami Tenshi Angeltia: Mamotta Ningentachi ni Uragirarete,Hentai,OVA,4,6.29,2286
8770,Shin Seikimatsu: Yatsuto no Souguu,"Comedy, Sci-Fi",ONA,5,4.9,73
8771,One Piece: Cry Heart,"Fantasy, Shounen",Special,3,6.85,3417
8772,Seiken Tsukai no World Break,"Action, Fantasy, Harem, Romance, School, Supernatural",TV,12,7.16,97401
8773,Gohan Kaijuu Pap,"Action, Comedy, Kids",TV,Unknown,4.25,104
8774,Momoya x Peeping Life: Go en Desu yo! II,"Comedy, Slice of Life",ONA,5,5.15,169
8775,Kuroko no Basket 2nd Season NG-shuu,"Comedy, Sports",Special,9,7.97,20477
8776,Peeping Life: Gekijou Original-ban,"Comedy, Slice of Life",Movie,5,4.67,161
8777,Appleseed Alpha,"Action, Adventure, Mecha, Military, Police, Sci-Fi",Movie,1,7.22,8048
8778,Shiroishi no Yousei Pichi,"Fantasy, Historical, Kids",ONA,3,4.53,104
8779,Terra Formars,"Action, Drama, Horror, Sci-Fi, Seinen, Space",TV,13,7.14,95964
8780,Terra Formars: Bugs 2-hen,"Action, Horror, Sci-Fi, Space",OVA,2,7.27,21616
8781,Lady Jewelpet,"Fantasy, Magic, Romance, Shoujo",TV,52,7.61,3085
8782,Dragon Ball Z: Summer Vacation Special,"Action, Adventure, Comedy, Fantasy, Martial Arts, Shounen, Super Power",Special,1,7.05,4251
8783,Dragon Ball Z: Zenbu Misemasu Toshi Wasure Dragon Ball Z!,"Action, Adventure, Comedy, Fantasy, Martial Arts, Shounen, Slice of Life, Super Power",Special,1,7,4153
8784,Zettai Zetsumei Dangerous Jiisan (2005),"Comedy, Kids",TV,19,7,66
8785,Wazaguu! vs. Dangerous Jiisan Ja: Houfukuzettou! Anime Quiz,"Comedy, Kids",OVA,1,6.17,56
8786,Aldnoah.Zero,"Action, Mecha, Sci-Fi",TV,12,7.66,244193
8787,Dragon Collection,"Fantasy, Shounen",TV,51,6.39,3229
8788,Oreca Battle,Game,TV,51,6.07,1632
8789,Brothers Conflict Special,"Harem, Romance, Shoujo",Special,1,6.81,10451
8790,Chikasugi Idol Akae-chan,"Comedy, Game, Parody",TV,12,4.28,112
8791,X Maiden,"Comedy, School, Slice of Life",ONA,8,4.58,372
8792,Toaru Kagaku no Railgun S: Daiji na Koto wa Zenbu Sentou ni Osowatta,Comedy,OVA,1,6.86,13119
8793,Kara no Kyoukai: Mirai Fukuin - Extra Chorus,"Drama, Mystery, Seinen, Supernatural",Special,1,7.56,14891
8794,Dragon Ball Kai (2014),"Action, Adventure, Comedy, Fantasy, Martial Arts, Shounen, Super Power",TV,61,8.01,42666
8795,Sono Hanabira ni Kuchizuke wo: Risa x Miya Gekijou,"Comedy, Romance, School, Shoujo Ai, Slice of Life",ONA,10,6.6,2291
8796,Barakamon,"Comedy, Slice of Life",TV,12,8.5,225927
8797,Sora Iro Hana Iro,"Drama, Slice of Life",Movie,1,6.25,55
8798,Yariman Fudousan,Hentai,OVA,2,5.92,1327
8799,Kindaichi Shounen no Jikenbo Returns,"Mystery, Shounen",TV,25,7.42,8128
8800,Aikatsu! Movie,"Music, School, Shoujo, Slice of Life",Movie,1,7.79,2813
8801,Himitsukessha Taka no Tsume EX,"Comedy, Parody, Super Power",TV,38,6.7,105
8802,Magical★Taruruuto-kun Movie,"Adventure, Comedy, Ecchi, Fantasy, Magic, School",Movie,1,6,77
8803,Abarenbou Rikishi!! Matsutarou,"Seinen, Sports",TV,23,6.2,5568
8804,Himegoto,"Comedy, School",TV,13,6.03,42129
8805,Cross Road,"School, Slice of Life",Special,1,7.58,23038
8806,Okashina Hotel,Dementia,Special,1,5.6,309
8807,Suzu 3 Tarou,"Comedy, Kids",ONA,24,6.25,44
8808,Kara no Kyoukai: Mirai Fukuin - Manner Movie,Drama,Movie,1,6.17,4260
8809,Nyamen,Comedy,TV,12,5.62,414
8810,Apo Apo World: Giant Baba 90-bun 1-hon Shoubu,"Comedy, Sports",Movie,1,5.14,72
8811,Takanashi Rikka Kai: Chuunibyou demo Koi ga Shitai! Movie Lite,Comedy,Special,1,7.26,13238
8812,Rokujouma no Shinryakusha!? (TV),"Comedy, Harem, Romance, School, Supernatural",TV,12,7.33,76880
8813,Seirei Tsukai no Blade Dance,"Action, Comedy, Ecchi, Fantasy, Harem, Romance, School, Supernatural",TV,12,7.15,124448
8814,Hyokkori Hyoutan Shima,"Adventure, Kids",Movie,1,6.4,59
8815,Mon Cheri CoCo,"Romance, Shoujo",TV,13,6.71,137
8816,Love es M The Animation,Hentai,OVA,1,6.4,1585
8817,Mugen Senshi Valis,"Action, Adventure, Fantasy",Special,1,5.75,215
8818,Hana no Zundamaru: Junk,"Comedy, Martial Arts, Parody",ONA,3,3.96,96
8819,Francesca,"Comedy, Fantasy",TV,24,5.64,6487
8820,Angel ga Tonda Hi,"Comedy, Slice of Life",Movie,1,5.67,77
8821,Date A Live: Encore OVA,"Romance, Slice of Life",OVA,1,8.01,48432
8822,Sangokushi,"Action, Historical",Special,1,7.86,68
8823,Kaibutsu-kun: Demon no Ken,"Comedy, Horror, Kids, Shounen",Movie,1,5.88,93
8824,Kaibutsu-kun: Kaibutsu Land e no Shoutai,"Comedy, Horror, Kids, Shounen",Movie,1,6.22,83
8825,Magical★Taruruuto-kun: Sukisuki Takoyaki!,"Adventure, Comedy, Ecchi, Fantasy, Magic, School",Movie,1,6.5,86
8826,Magical★Taruruuto-kun: Moeru! Yuujou no Mahou Taisen,"Adventure, Comedy, Ecchi, Fantasy, Magic, School",Movie,1,6.6,91
8827,Hipira-kun ONA,"Comedy, Fantasy, Kids, Supernatural, Vampire",ONA,2,6.01,318
8828,Hipira-kun Special,"Comedy, Fantasy, Kids, Supernatural, Vampire",Special,1,4.78,178
8829,Obake no Q-Tarou: Susume! 1/100 Daisakusen,"Comedy, Kids, School, Slice of Life, Supernatural",Movie,1,6.6,61
8830,Obake no Q-Tarou: Tobidase! Bake Bake Daisakusen,"Comedy, Kids, School, Slice of Life",Movie,1,5.6,59
8831,Shisei Sasshin,Slice of Life,Movie,1,8.67,51
8832,Shin Skyers 5,"Action, Sci-Fi",TV,26,6.25,68
8833,Nippon Tanjou,Historical,TV,5,5.4,62
8834,Manga Jinbutsushi,Historical,TV,365,6.91,71
8835,Tanoshii Bunmeishi: Tetsu Monogatari,"Historical, Slice of Life",Movie,1,6.67,63
8836,Mogura no Motoro,Slice of Life,Movie,1,9.5,62
8837,Ookami Shounen Ken (Movie),"Adventure, Kids",Movie,1,4,73
8838,Ookami Shounen Ken: Arabia no Kaijin - Ma no Iwa no Kettou,"Adventure, Kids",Movie,1,6.57,85
8839,Otoko Doahou! Koushien,"Action, Sports",TV,156,6.6,86
8840,Norakuro,Comedy,TV,26,6,94
8841,Hazedon,"Adventure, Comedy, Kids",TV,26,5.8,61
8842,Peaceful Times (F02) Petit Film,Music,Music,1,5.07,1650
8843,Popful Mail,"Comedy, Fantasy, Music",Music,1,5.85,166
8844,Ashita no Kibou: Kanashimi yo Arigatou - Takae Tsuneo Monogatari,"Drama, Slice of Life",Movie,1,6.33,124
8845,Furueru Kuchibiru,Hentai,OVA,1,6.82,3285
8846,Bakumatsu Rock,"Action, Comedy, Historical, Music, Shoujo",TV,12,6.2,18680
8847,Re Boot,"Drama, Music, School, Slice of Life",Music,1,7.25,1544
8848,Tennen Koi-iro Alcohol,Hentai,OVA,2,6.84,2571
8849,Ga no Iru Tokoro,Dementia,Movie,1,4.68,343
8850,Nisou no Kuzu,Psychological,Movie,1,5.22,265
8851,Kangaeru Renshuu,Kids,Movie,1,4.46,213
8852,Yukidoke,"Dementia, Horror",Movie,1,4.25,945
8853,Shinsatsushitsu,"Dementia, Horror",Movie,1,4.54,527
8854,Heya/Keitai,"Fantasy, Music",Movie,1,5.59,311
8855,Usagi ga Kowai,"Dementia, Game, Horror",Movie,1,4.85,610
8856,Kaidan,Supernatural,Movie,1,5.13,293
8857,Tenkai Knights,"Action, Adventure, Comedy, Kids, Mecha, Sci-Fi, Shounen, Super Power",TV,52,6.82,1249
8858,Glasslip,"Romance, Slice of Life, Supernatural",TV,13,5.54,94108
8859,Happiness Charge PreCure! Movie: Ningyou no Kuni no Ballerina,"Fantasy, Kids, Magic, Shoujo",Movie,1,7.18,1332
8860,Kikansha Sensei,"Comedy, School, Slice of Life",Movie,1,6.67,76
8861,Ponsuke no Haru,"Comedy, Kids",Movie,1,6.33,62
8862,Kousagi Monogatari,"Comedy, Kids",Movie,1,6.2,67
8863,Puchitto Gargantia Special,"Comedy, Mecha, Sci-Fi",Special,1,6.12,1786
8864,Kuraibito,Hentai,OVA,1,6.29,2187
8865,GO-GO Tamagotchi!,"Comedy, Fantasy, Kids",TV,50,7.17,198
8866,Hamatora The Animation: Saishuukai Chokuzen! Mao ga Okuru Soushuuhen Special,"Comedy, Mystery, Super Power",Special,1,6.85,4587
8867,Jinsei,"Comedy, School, Slice of Life",TV,13,6.59,40413
8868,Histoire d&#039;Etty,"Kids, Slice of Life",Movie,1,6.5,68
8869,Mahou no Princess Minky Momo: Hitomi no Seiza - Minky Momo Song Special,"Magic, Music, Shoujo",Music,1,5.49,147
8870,M3: Sono Kuroki Hagane,"Action, Drama, Mecha, Mystery, Psychological, Sci-Fi",TV,24,6.72,38301
8871,PriPara,"Music, School, Shoujo, Slice of Life",TV,Unknown,7.17,7680
8872,Girls und Panzer Heartful Tank Disc Picture Drama,"Military, School",Special,4,6.63,2296
8873,47 Todoufuken R,"Comedy, Kids",TV,12,5.81,122
8874,Shounen Hollywood: Holly Stage for 49,"Music, Shoujo, Slice of Life",TV,13,6.15,10776
8875,Hayate no Gotoku! OVA,"Comedy, Harem, Parody, Romance, Shounen",OVA,3,7.26,6001
8876,Kaze no Invitation,"Magic, Music",Music,1,5.57,229
8877,Mahou Shoujo wa Kiss Shite Kawaru,Hentai,OVA,1,5.09,1081
8878,Piano Specials,"Drama, Music, Romance, Shoujo, Slice of Life",Special,4,5.33,194
8879,Kyoukai no Rinne,"Comedy, Supernatural",Special,1,6.16,2983
8880,Otogi Banashi: Bunbuku Chagama,Kids,Movie,1,6.33,85
8881,Itazura Post,Comedy,Movie,1,7,77
8882,Chamebou Kuukijuu no Maki,Comedy,Movie,1,8.4,66
8883,Chamebou Shin Gachou: Nomi Fuufu Shikaeshi no Maki,Comedy,Movie,1,6,72
8884,Dekoboko Shin Gachou: Meian no Shippai,Comedy,Movie,1,7.08,102
8885,Chokin no Susume,Comedy,Movie,1,6,71
8886,Durarara!!x2 Shou,"Action, Mystery, Supernatural",TV,12,8.15,189407
8887,Sengoku Basara: Judge End,"Action, Historical, Martial Arts, Samurai, Super Power",TV,12,6.95,14568
8888,Sora no Method,"Drama, Fantasy, School, Slice of Life",TV,13,6.77,47900
8889,Kantoku Fuyuki Todoki,"Comedy, Josei, Slice of Life",TV,13,5.94,4037
8890,Yuru Yuri Nachuyachumi!,"Comedy, Shoujo Ai, Slice of Life",OVA,1,7.95,28339
8891,Mikakunin de Shinkoukei: Kamoniku tte Midori-ppoi Aji ga Suru no ne.,"Comedy, Romance, Seinen, Slice of Life",OVA,1,7.2,21717
8892,Meshimase Lodoss-tou Senki: Sorette Oishii no?,Comedy,TV,13,5.94,1187
8893,Shinmai Maou no Testament,"Action, Demons, Ecchi, Fantasy, Harem, Romance",TV,12,7.11,172321
8894,Chuunibyou demo Koi ga Shitai! Ren Specials,Comedy,Special,7,7.17,20337
8895,Go Go Toraemon,"Comedy, Sports",OVA,1,4.7,57
8896,Oshaburi Announcer,Hentai,OVA,1,6.84,1808
8897,Uchuu Senkan Yamato 2199: Hoshimeguru Hakobune,"Action, Drama, Military, Sci-Fi, Space",Movie,1,7.93,5431
8898,Gugure! Kokkuri-san,"Comedy, Shounen, Supernatural",TV,12,7.69,87824
8899,Gundam: G no Reconguista,"Action, Mecha, Sci-Fi, Space",TV,26,5.86,16538
8900,Genroku Koi Moyou: Sankichi to Osayo,"Adventure, Romance",Movie,1,4.93,108
8901,Osaru no Tairyou,Slice of Life,Movie,1,4.36,111
8902,Hello!! Kiniro Mosaic,"Comedy, School, Slice of Life",TV,12,7.63,33295
8903,Shigatsu wa Kimi no Uso,"Drama, Music, Romance, School, Shounen",TV,22,8.92,416397
8904,Tsubu★Doll,Music,OVA,5,,1060
8905,Saenai Heroine no Sodatekata,"Comedy, Ecchi, Harem, Romance, School",TV,12,7.69,155795
8906,Gyakusatsu Kikan,"Psychological, Sci-Fi",Movie,1,,12529
8907,Psycho-Pass 2,"Action, Police, Psychological, Sci-Fi",TV,11,7.6,228435
8908,Zankyou no Terror,"Psychological, Thriller",TV,11,8.26,342893
8909,Poulette no Isu,"Comedy, Kids, Slice of Life",ONA,1,7.16,3675
8910,Gekkan Shoujo Nozaki-kun,"Comedy, Romance, School",TV,12,8.24,292622
8911,Lupin the IIIrd: Jigen Daisuke no Bohyou,"Action, Adventure, Comedy, Drama, Seinen",Movie,1,7.91,5939
8912,Pokemon Best Wishes! Season 2: Decolora Adventure - Iris vs. Ibuki! Dragon Master e no Michi!!,"Action, Adventure, Comedy, Fantasy, Kids",Special,1,6.79,2935
8913,Pokemon XY: Mega Evolution,"Action, Adventure, Comedy, Fantasy, Kids",Special,4,7.7,10227
8914,Hiroshima e no Tabi,"Drama, Historical, Slice of Life",OVA,1,5.75,64
8915,Shin Sei Yariman Gakuen Enkou Nikki The Animation,Hentai,OVA,1,6.62,2563
8916,Rail Wars!,"Action, Ecchi, Police",TV,12,6.47,85487
8917,Garo: Honoo no Kokuin,"Action, Demons, Fantasy, Magic, Supernatural",TV,24,7.51,64214
8918,Zettai Zetsumei Dangerous Jiisan,"Comedy, Kids",TV,33,5.82,76
8919,Zettai Zetsumei Dangerous Jiisan Special-ban,"Comedy, Kids",Special,1,6.8,57
8920,Kuroshitsuji: Book of Murder,"Comedy, Demons, Fantasy, Historical, Mystery, Shounen, Supernatural",OVA,2,8.41,67261
8921,"Suisei no Gargantia: Meguru Kouro, Haruka","Action, Adventure, Mecha, Sci-Fi",OVA,2,7.46,20151
8922,Log Horizon 2nd Season,"Action, Adventure, Fantasy, Game, Magic, Shounen",TV,25,7.66,215817
8923,Shirogane no Ishi: Argevollen,"Action, Mecha",TV,24,6.56,30770
8924,Space☆Dandy 2nd Season,"Comedy, Sci-Fi, Space",TV,13,8.27,60918
8925,DRAMAtical Murder,"Action, Psychological, Sci-Fi, Super Power",TV,12,6.32,80121
8926,Mahouka Koukou no Rettousei: Yoku Wakaru Mahouka!,"Comedy, Magic",ONA,6,6.38,13068
8927,Futari no Oujisama,"Fantasy, Slice of Life",Movie,1,6.5,77
8928,Yukiguni no Oujisama,Slice of Life,Movie,1,7,62
8929,Gan to Gon,"Comedy, Kids",TV,260,6.7,61
8930,Kirin Monoshiri Yakata,Kids,TV,1565,5.56,116
8931,Youkaiden Nekome Kozou,"Adventure, Horror, Psychological, Seinen, Supernatural",TV,25,8,153
8932,Itsuka no Main: Kaminari Shounen - Tenta Sanjou!,"Action, Drama, Seinen",OVA,1,6.73,100
8933,Code Geass: Boukoku no Akito 2 - Hikisakareshi Yokuryuu Picture Drama,"Action, Comedy, Military",Special,1,7.54,7542
8934,Bakuman. 3rd Season Specials,Comedy,Special,2,7.22,6765
8935,Ore no Imouto ga Konnani Kawaii Wake ga Nai.: Ore no Imouto ga Konnani Eroge na Wake Nai,"Comedy, Romance",Special,1,6.78,3609
8936,By Your Side,Music,Music,1,6.27,550
8937,Kitakubu Katsudou Kiroku: Miniature Theater,"Comedy, School",Special,6,6.33,1154
8938,Bakuman. 2nd Season Special,Comedy,Special,1,7.02,6812
8939,Minarai Diva,Music,TV,10,5.73,982
8940,D-Frag! OVA,"Comedy, Game, Seinen",OVA,1,7.47,28116
8941,Kyoukai no Kanata: Shinonome,"Fantasy, Slice of Life, Supernatural",Special,1,7.78,42344
8942,Master of Torque,"Action, Sci-Fi",ONA,4,5.25,693
8943,Shin Don Chuck Monogatari,"Adventure, Kids, Slice of Life",TV,73,6.48,103
8944,Minami no Shima no Dera-chan,"Comedy, Slice of Life",Movie,1,6.55,7224
8945,Tobacco wa Dasai,"School, Slice of Life",ONA,1,5.26,222
8946,Tokyo Ravens: Kon ga Oshiete Moshi Agemasu! Maru Wakari Tokyo Ravens,"Shounen, Supernatural",ONA,3,6.91,5949
8947,Toki: Kono Hoshi no Mirai wo Mitsumete,"Drama, Historical",Special,2,5.57,60
8948,Duel Masters VS,"Action, Adventure, Comedy, Shounen",TV,49,6.27,374
8949,Re:␣Hamatora,"Comedy, Mystery, Super Power",TV,12,7.48,73903
8950,Mujaki no Rakuen,"Comedy, Ecchi, Romance, School, Seinen",OVA,3,6.09,12054
8951,Karneval Specials,Comedy,Special,11,7.13,4415
8952,Oneechan ga Kita Special,"Comedy, Slice of Life",Special,1,6.6,11094
8953,Shin Strange+,"Comedy, Shoujo, Slice of Life",TV,12,6.39,9385
8954,Toki wa Meguru: Tokyo Station,Slice of Life,ONA,1,6.78,2862
8955,Love Stage!! OVA,"Comedy, Romance, Shounen Ai",OVA,1,7.74,23631
8956,"Ano Natsu de Matteru: Bokutachi wa Koukou Saigo no Natsu wo Sugoshinagara, Ano Natsu de Matteiru.","Comedy, Drama, Romance, Sci-Fi, Slice of Life",Special,1,7.29,19772
8957,Sekai Seifuku: Bouryaku no Zvezda - Shin Zvezda Daisakusen,"Action, Comedy, Fantasy",Special,1,6.81,10141
8958,Saimin Jutsu Zero Special,Hentai,Special,1,6,648
8959,Kakushi Dere Special,Hentai,Special,1,6.38,983
8960,Itadaki! Seieki♥ Special,Hentai,Special,1,7.1,2815
8961,Decorator,Music,Music,1,6.12,880
8962,Witch Craft Works Specials,"Comedy, Magic",Special,6,6.83,4311
8963,Gakumon!: Ookami Shoujo wa Kujikenai,"Comedy, School, Shounen",ONA,3,6.75,1477
8964,Choubakuretsu Ijigen Menko Battle: Gigant Shooter Tsukasa,"Action, Comedy, Game, Kids",TV,32,5.72,162
8965,Otsuki-sama to Oujo,Fantasy,OVA,1,6.2,68
8966,Calligraffiti,Music,Movie,1,4.57,200
8967,Enbi,Hentai,OVA,2,6.27,1507
8968,Aterui,"Action, Fantasy, Historical",Movie,1,4.4,105
8969,Two Down Full Base,"Kids, Sports",Special,1,6.38,57
8970,Gudetama,"Comedy, Kids",TV,Unknown,7.36,2348
8971,Choboraunyopomi Gekijou Dai Ni Maku Ai Mai Mii: Mousou Catastrophe,"Comedy, Slice of Life",TV,12,5.95,6220
8972,Neko no Dayan,"Kids, Magic",TV,52,5.38,297
8973,Kagirinaki Rakuen,Slice of Life,Movie,1,7.25,86
8974,Ikkyuu-san: Ooabare Yancha-hime,"Comedy, Historical, Kids",Special,1,5.9,71
8975,12-sai.,"Romance, School, Shoujo",OVA,8,6.59,6211
8976,Romeo no Aoi Sora Specials,"Adventure, Drama, Historical, Slice of Life",Special,2,6.7,297
8977,Akage no Anne Specials,"Drama, Historical, Kids, Shoujo, Slice of Life",Special,2,6.49,331
8978,Haha wo Tazunete Sanzenri Specials,"Adventure, Drama, Slice of Life",Special,2,6.14,138
8979,The iDOLM@STER Cinderella Girls,"Comedy, Drama, Music",TV,13,7.2,33042
8980,Saitama Bousou Saizensen Flag! Shinimonogurui no Seishun!!,"Drama, Slice of Life",OVA,1,6,62
8981,Seihou Tenshi Angel Links Special,"Comedy, Sci-Fi, Space",Special,1,5.86,310
8982,Legend of Basara: Shinbashi Theater,Comedy,Special,1,6.31,163
8983,Ninja Slayer From Animation,Action,ONA,26,6.56,26062
8984,Gaki Deka,"Comedy, Ecchi, Kids, Parody, Shounen",TV,22,5,72
8985,Gaki Deka (OVA),"Comedy, Ecchi, Kids, Parody, Shounen",OVA,3,4.78,62
8986,Bunna yo Ki kara Orite Koi,"Adventure, Kids",Movie,1,6.25,53
8987,Kakkun Cafe,"Comedy, Parody, Slice of Life",Movie,1,5.86,54
8988,Eiyuu Banka Koushi-den,"Adventure, Drama, Historical, Romance",OVA,1,6.44,101
8989,Sore Ike! Anpanman: Ringo Boy to Minna no Negai,"Comedy, Fantasy, Kids",Movie,1,6.44,73
8990,Haiyore! Nyaruko-san W OVA,"Comedy, Ecchi, Parody",OVA,1,7.19,14585
8991,"Sagashita no wa Oheya, Mitsuketa no wa Mirai","Romance, Slice of Life",ONA,1,6.12,204
8992,Non Non Biyori Repeat,"Comedy, School, Seinen, Slice of Life",TV,12,8.26,64230
8993,Aoki Hagane no Arpeggio: Ars Nova - Kirikumas,"Comedy, Parody",Special,13,6.77,2913
8994,Poppoya-san: Nonki Ekichou,Kids,Movie,1,7.57,74
8995,Poppoya-san: Nonki Kikanshi,Kids,Movie,1,7.14,67
8996,Kobito to Ao Mushi,"Kids, Music",Movie,1,6.43,74
8997,Kappa Kawatarou,"Kids, Supernatural",Movie,1,4.85,101
8998,Ukare Violin,"Fantasy, Kids",Movie,1,6.75,61
8999,Nezumi no Yomeiri,"Fantasy, Kids",Movie,1,4.96,89
9000,Ookami to Nanahiki no Ko Yagi,"Fantasy, Kids",OVA,1,6.8,60
9001,Ninja Hattori-kun: Nin Nin Furusato Daisakusen no Maki,"Comedy, Kids, Martial Arts, Slice of Life",Movie,1,6,108
9002,Hanawa Hekonai Kappa Matsuri,"Comedy, Kids",Movie,1,6.6,72
9003,Hi no Tori: Hagoromo-hen,Drama,Movie,1,6.42,139
9004,Glass no Chikyuu wo Sukue Unico Tokubetsu-hen,"Fantasy, Kids",Movie,1,6.61,148
9005,Renai Fuyou Gakuha The Animation,Hentai,OVA,1,6.85,2057
9006,Ookami Shoujo to Kuro Ouji,"Comedy, Romance, School, Shoujo",TV,12,7.47,145439
9007,Hi no Tori: Kizuna-hen,"Fantasy, Kids",Special,1,7.56,138
9008,Manga Edo Erobanashi,"Comedy, Hentai, Historical",OVA,5,2.86,111
9009,Strange+ Special,"Comedy, Shoujo, Slice of Life",Special,1,6.04,1235
9010,Kara no Kyoukai: Manner Movies,"Action, Comedy",Movie,7,6.49,5367
9011,Kumo ni Noru,"Action, Seinen",OVA,2,5.18,118
9012,Toradora! OVA,"Comedy, Romance, School, Slice of Life",OVA,1,7.72,25154
9013,Gatchaman Crowds: Embrace,"Adventure, Sci-Fi",Special,1,7.5,10757
9014,Sabaku no Kuni no Oujosama,"Adventure, Fantasy",OVA,1,6.4,65
9015,Hana to Shounen,Fantasy,OVA,1,7.25,55
9016,Kakumei no Wakaki Sora,"Drama, Historical",OVA,1,6.68,379
9017,Nagareboshi no Okurimono,"Fantasy, Kids",OVA,1,6.29,45
9018,Rennyuu Tales The Animation,Hentai,OVA,1,6.62,1859
9019,Carino Coni,"Fantasy, Kids",TV,26,6.93,99
9020,Teppen,"Action, Comedy",OVA,2,4.69,86
9021,Strike Witches: Operation Victory Arrow,"Action, Ecchi, Magic, Military, Sci-Fi",OVA,3,7.49,11203
9022,Kansuke-san to Fushigi na Jitensha,"Fantasy, Kids",Movie,1,5.5,53
9023,Minna Tomodachi,"Comedy, Fantasy, Kids",OVA,1,5,41
9024,"Boku datte, Kirei ni Shitainda",Kids,OVA,1,4,54
9025,Kosys! Kochira Keihime Tetsudou: Kouhou System-ka,"Comedy, Slice of Life",ONA,2,4.6,189
9026,Kenzen Robo Daimidaler Specials,"Comedy, Ecchi, Mecha, Seinen",Special,6,6.22,3816
9027,Neko Pitcher,"Comedy, Kids, Sports",TV,51,7.13,308
9028,Peter Pan no Bouken Specials,"Adventure, Fantasy",Special,2,5.71,128
9029,Wakakusa Monogatari: Nan to Jo-sensei Specials,"Drama, Historical, School, Slice of Life",Special,2,6.36,138
9030,Kishin Houkou Demonbane (TV) Specials,"Magic, Mecha, Sci-Fi, Supernatural",Special,2,6.2,571
9031,Nanatsu no Taizai,"Action, Adventure, Ecchi, Fantasy, Shounen, Supernatural",TV,24,8.42,331627
9032,Oira no Ski,"Comedy, Sports",Movie,1,5.31,201
9033,Konna ni Yasashiku Sareta no,Hentai,OVA,3,5.74,1413
9034,Manga Aesop Monogatari,"Adventure, Fantasy, Kids",Movie,1,5.87,81
9035,Yamiyo no Jidaigeki,"Historical, Horror",Special,2,4.27,89
9036,Yamiyo no Jidaigeki (OVA),"Historical, Horror",OVA,2,4.33,74
9037,Toppuku Kyousou Kyoku,"Comedy, Shounen",OVA,2,5.54,63
9038,Shingeki no Kyojin Movie 1: Guren no Yumiya,"Action, Drama, Fantasy, Shounen, Super Power",Movie,1,7.7,31990
9039,Shingeki no Kyojin Movie 2: Jiyuu no Tsubasa,"Action, Drama, Fantasy, Shounen, Super Power",Movie,1,7.75,26958
9040,Akuma to Himegimi,"Comedy, Shoujo",Movie,1,4.88,111
9041,Blade &amp; Soul Specials,Comedy,Special,7,5.95,5167
9042,Hi☆sCoool! SeHa Girls,"Comedy, Game",TV,13,6.6,7440
9043,Dango San Kyoudai Attoiuma Gekijou,"Kids, Music",TV,50,7.3,74
9044,Doctor Mambo &amp; Kaitou Jibako: Uchuu yori Ai wo Komete!!,"Adventure, Fantasy, Kids, Mystery, Sci-Fi",Special,1,5.67,62
9045,Gokuu no Daibouken Pilot,"Comedy, Fantasy",Special,1,5.22,85
9046,Onimaru: Senjou ni Kakeru Itsutsu no Seishun,"Action, Adventure",OVA,1,5.25,76
9047,Ys IV: The Dawn of Ys,"Action, Adventure, Fantasy, Game",Special,1,6.12,237
9048,Komatsu Sakyo Anime Gekijou,"Comedy, Parody, Sci-Fi, Space",TV,24,5.17,76
9049,Mahou Shoujo Madoka★Magica Movie 3: Hangyaku no Monogatari - Magica Quartet x Nisioisin,Comedy,Movie,4,6.52,6946
9050,Moonrakers,"Drama, Sci-Fi, Space",ONA,1,5.73,1013
9051,Meisou! Underworld,"Action, Supernatural, Thriller",ONA,1,5.93,1456
9052,Yahari Ore no Seishun Love Comedy wa Machigatteiru. Zoku,"Comedy, Drama, Romance, School",TV,13,8.31,222994
9053,Pokemon XY: Sora no Hahen,"Adventure, Fantasy, Kids",Movie,1,6.97,2360
9054,Dennou Sentai Voogie&#039;s★Angel Gaiden: Susume! Super★Angels!,"Action, Comedy, Mecha, Parody, Sci-Fi",OVA,2,5.25,110
9055,Go! Go! Kadendanshi 2nd Season,"Action, Seinen",ONA,78,5.25,82
9056,Ai no Kiseki: Doctor Norman Monogatari,"Drama, Slice of Life",Special,1,6.23,107
9057,Ganbare Swimmy,Adventure,Movie,1,7.6,55
9058,Ojisan Kaizou Kouza,Comedy,Movie,1,6.43,60
9059,Saru Kani Gassen: Ijimekkozaru to Shoujiki Kani-san,"Comedy, Kids",OVA,1,5.25,49
9060,Ji no Nai Hagaki,Slice of Life,OVA,1,6,56
9061,Puchimas!!: Petit Petit iDOLM@STER - Fuyu→Kotatsu←Haru,"Comedy, Music, Slice of Life",OVA,1,6.85,1246
9062,Gondora,Dementia,Movie,1,4.21,707
9063,Momon&#039;s Sand Witch,"Comedy, Kids",ONA,8,4.82,116
9064,Momon&#039;s Sand Witch Episode 0,"Comedy, Kids",ONA,1,5,91
