anime_id,name,genre,type,episodes,rating,members
2817,Rankou Choukyou: Maid ni Natta Shoujo,Hentai,OVA,1,5.41,713
2818,Sono Kinisasete yo: My My Mai,"Comedy, Ecchi, Supernatural",OVA,2,6.07,1018
2819,Shutsugeki! Machine Robo Rescue,"Action, Mecha, Sci-Fi",TV,53,6.93,636
2820,Juusenshi Gulkeeva,"Action, Fantasy, Mecha, Super Power",TV,26,6.58,855
2821,Kamen Rider SD Kaiki?! Kumo Otoko,"Action, Parody",OVA,1,6.64,575
2822,F-Zero: Falcon Densetsu,"Action, Adventure, Cars, Mecha, Sci-Fi, Shounen, Sports",TV,51,6.46,3863
2823,Kateikyoushi no Oneesan The Animation: H no Hensachi Agechaimasu,Hentai,OVA,2,7.29,7218
2824,Geisters: Fractions of the Earth,"Action, Sci-Fi",TV,26,6.09,670
2825,Chikansha Thomas,Hentai,OVA,1,6.2,2068
2826,Dark Shell: Ori no Naka no Namameki,Hentai,OVA,2,6.29,2785
2827,Miboujin: Numeriau Nikuyoku to Midara ni Nureru Mitsusubo,Hentai,OVA,2,6.07,1363
2828,Mei King,"Adventure, Comedy, Fantasy, Hentai",OVA,4,6.19,1106
2829,Kaze no Naka no Shoujo: Kinpatsu no Jeanie,"Drama, Historical",TV,52,7.17,1414
2830,Nasu: Suitcase no Wataridori,"Drama, Seinen, Sports",OVA,1,7.28,1843
2831,Papillon Rose,"Comedy, Ecchi, Magic, Parody",TV,6,5,1817
2832,Pinky Street,"Comedy, Slice of Life",OVA,2,4.78,619
2833,Chiisana Kyojin Microman,"Action, Adventure, Comedy, Kids, Mecha, Sci-Fi, Shounen, Super Power",TV,52,6.53,411
2834,Toki no Tabibito: Time Stranger,"Action, Adventure, Romance, Sci-Fi",Movie,1,6.33,941
2835,Dash! Yonkurou,"Action, Kids, Shounen, Sports",TV,25,7.08,895
2836,Bobby ni Kubittake,"Drama, Romance, Slice of Life",Movie,1,6.33,1470
2837,Kodomo no Jikan OVA,"Comedy, Ecchi, School",OVA,3,7.23,20376
2838,Tokimeki Tonight,"Comedy, Fantasy, Romance, Shoujo, Vampire",TV,34,7.48,3057
2839,California Crisis: Tsuigeki no Juuka,"Action, Adventure, Comedy",OVA,1,5.77,1604
2840,Kaibutsu-kun,"Comedy, Horror",TV,49,6.93,460
2841,Kaibutsu-kun (1980),"Comedy, Horror, Kids",TV,94,6.79,293
2842,Ashita Tenki ni Naare,Sports,TV,47,6.5,297
2843,Boukensha: The Man Was from Spain,"Adventure, Historical",TV,26,6.49,496
2844,Dragon&#039;s Heaven,"Action, Adventure, Fantasy, Mecha, Sci-Fi",OVA,1,6.23,1924
2845,Ochamegami Monogatari: Korokoro Pollon,"Comedy, Magic, Parody",TV,46,7.13,1049
2846,Tsurikichi Sanpei,"Adventure, Sports",TV,109,7.17,1650
2847,Solty Rei Special,"Comedy, Drama",Special,1,7.18,2641
2848,Ryoujoku no Machi: Kyouen no Ceremony,"Fantasy, Hentai, Military",OVA,1,5.7,1461
2849,GR: Giant Robo,"Adventure, Mecha, Military, Sci-Fi, Shounen",TV,13,6.9,1546
2850,Me gumi no Daigo: Kajiba no Baka Yarou,Drama,Movie,1,6.53,490
2851,Genei Toushi Bastof Lemon,"Adventure, Mecha, Sci-Fi",TV,26,6.29,666
2852,Down Load: Namu Amida Butsu wa Ai no Uta,"Action, Adventure, Psychological, Sci-Fi",OVA,1,5.93,740
2853,Kagaku Ninja-tai Gatchaman (Movie),"Action, Adventure, Sci-Fi, Shounen",Movie,1,6.54,694
2854,Gatchaman,"Action, Adventure, Martial Arts, Sci-Fi, Shounen, Super Power",OVA,3,6.59,1407
2855,Kingyo Chuuihou! (Movie),"Action, Comedy, Kids, Shoujo",Movie,1,6.3,301
2856,Guardian Hearts-Power UP!,"Action, Comedy, Ecchi, Fantasy, Harem, Magic, Romance",OVA,4,6.05,2402
2857,The Kabocha Wine,"Comedy, Romance, School, Slice of Life",TV,95,6.92,871
2858,Houkago Mania Club: Koi no Hoshii no,"Hentai, Yuri",OVA,2,5.46,1710
2859,Makiba no Shoujo Katri,"Adventure, Drama, Historical, Slice of Life",TV,49,6.9,1048
2860,Ichigo Ichie: Koibana Tomobana,Comedy,TV,13,7.1,260
2861,Hidamari Sketch Specials,"Comedy, School, Slice of Life",Special,2,7.62,13334
2862,Ayakashi,"Action, Fantasy, Horror, Sci-Fi",TV,12,6.5,20882
2863,Eve no Jikan,"Sci-Fi, Slice of Life",ONA,6,8.26,99074
2864,Ryoujoku Hitozuma Onsen,Hentai,OVA,2,6.63,2099
2865,Sola Specials,"Comedy, Romance, Slice of Life, Supernatural",Special,2,7.06,12223
2866,Kaitei Choutokkyuu: Marine Express,"Action, Adventure, Comedy, Drama, Sci-Fi",Special,1,6.37,551
2867,Nessa no Haou Gandalla,"Adventure, Drama, Fantasy, Horror, Magic, Music, Sci-Fi, Supernatural",TV,26,6.15,637
2868,Hengen Taima Yakou Karura Mau! Nara Onryou Emaki,"Action, Adventure, Demons, Fantasy, Horror, Shoujo, Supernatural",Movie,1,6.19,506
2869,Manga Aesop Monogatari (TV),"Comedy, Fantasy, Kids",TV,52,6.5,175
2870,Massugu ni Ikou. 2nd Season,"Comedy, Josei, Romance, Slice of Life",TV,5,6.85,904
2871,MAPS: Densetsu no Samayoeru Seijin-tachi,"Action, Adventure, Drama, Sci-Fi, Shounen, Space",OVA,1,6.2,402
2872,Fortune Quest L,"Adventure, Comedy, Fantasy, Magic",TV,26,6.66,845
2873,Sekai Meisaku Douwa: Hakuchou no Mizuumi,"Drama, Fantasy, Romance",Movie,1,7.31,1705
2874,Guitar wo Motta Shounen: Kikaider vs. Inazuman,"Sci-Fi, Shounen",Special,1,6.69,678
2875,Tobira wo Akete,"Action, Adventure, Fantasy, Sci-Fi",Movie,1,5.92,894
2876,Asobot Senki Gokuu,"Comedy, Sci-Fi",TV,52,6.91,1633
2877,Ningyohime Marina no Bouken,"Drama, Fantasy, Kids, Romance",TV,26,6.57,889
2878,Wakakusa no Charlotte,"Drama, Historical, Kids, Shoujo, Slice of Life",TV,30,6.99,1019
2879,Nanatsu no Umi no Tico,"Adventure, Slice of Life",TV,39,7.54,2123
2880,Pure-tou no Nakama-tachi,"Fantasy, Kids",TV,26,6.5,386
2881,Daisuki! Hello Kitty,"Fantasy, Kids",TV,26,6.49,1468
2882,Chibi Maruko-chan Movie,"Comedy, School, Shoujo",Movie,1,7.41,980
2883,Cream Lemon: Lemon Angel,Ecchi,TV,37,6.07,1068
2884,Ikoku Irokoi Romantan,"Comedy, Romance, Yaoi",OVA,2,7.25,24223
2885,Otenki Oneesan,"Comedy, Hentai, Yuri",OVA,2,5.63,1040
2886,Ganbare Genki,"Action, Comedy, Shounen, Sports",TV,35,7.6,805
2887,Kosuke-sama Rikimaru-sama: Konpeitou no Ryuu,"Action, Adventure, Super Power",OVA,1,6.35,437
2888,Fuyu no Hi,Historical,Movie,1,6.35,2380
2889,Gensoumaden Saiyuuki OVA,"Adventure, Shounen, Supernatural",OVA,2,7.31,3223
2890,Gakuen Utopia Manabi Straight! Special,"Comedy, School, Sci-Fi, Slice of Life",Special,1,7.24,4800
2891,Kanashimi no Belladonna,"Drama, Hentai",Movie,1,7.28,6599
2892,Shakugan no Shana Movie Special,"Adventure, Comedy, Fantasy, Parody",Special,1,7.25,19488
2893,Kiddy Grade: Maelstrom,"Action, Mecha, Sci-Fi, Super Power",Movie,1,7.33,3189
2894,Kiddy Grade: Truth Dawn,"Action, Mecha, Sci-Fi, Super Power",Movie,1,7.34,3174
2895,Minami-ke Okawari,"Comedy, School, Slice of Life",TV,13,7.41,50837
2896,Major S4,"Comedy, Drama, Shounen, Sports",TV,26,8.35,28002
2897,Harukanaru Toki no Naka de 3: Kurenai no Tsuki,"Action, Fantasy, Historical, Military, Shoujo",Special,1,7.01,2355
2898,Zoku Sayonara Zetsubou Sensei,"Comedy, Parody, School",TV,13,8.03,74040
2899,Kimi ga Aruji de Shitsuji ga Ore de,"Comedy, Ecchi, Harem, Parody, Romance",TV,13,7.35,66236
2900,Druaga no Tou: The Aegis of Uruk,"Adventure, Comedy, Fantasy",TV,12,7.35,69683
2901,Gunslinger Girl: Il Teatrino,"Action, Drama, Military, Sci-Fi",TV,13,7.3,38498
2902,Bannou Bunka Neko-Musume Specials,"Action, Adventure, Comedy, Mecha, Sci-Fi, Seinen",Special,2,6.72,950
2903,009-1: R&amp;B,"Action, Sci-Fi, Seinen",Special,1,6.44,2988
2904,Magma Taishi,"Action, Sci-Fi, Shounen, Space, Super Power",OVA,13,5.98,421
2905,Cream Lemon,"Comedy, Drama, Fantasy, Hentai, Parody, Romance, Sci-Fi, Yuri",OVA,38,6.54,2603
2906,Elec-king The Animation,Comedy,TV,13,6.55,96
2907,Kindaichi Shounen no Jikenbo Specials,"Mystery, Shounen",Special,2,7.35,1194
2908,Love Hina Final Selection,"Comedy, Ecchi, Harem, Romance",OVA,1,7.32,21824
2909,Tenpou Ibun: Ayakashi Ayashi - Ayashi Shinkyoku,"Action, Drama, Historical, Supernatural",Special,5,7,1892
2910,Daishikkin Helena,Hentai,OVA,2,6.02,2503
2911,Hatara Kids Mai Ham Gumi,"Action, Kids",TV,50,5.54,190
2912,Super Express Mazinger 7,"Mecha, Sci-Fi",Movie,1,5.15,362
2913,Luv Wave,"Action, Drama, Hentai, Horror, Mystery, Police, Romance, Sci-Fi",OVA,3,6.19,1258
2914,Soukou Kihei Votoms: Pailsen Files,"Mecha, Military, Sci-Fi, Space",OVA,12,7.44,2861
2915,Lily C.A.T.,"Horror, Sci-Fi, Space",Movie,1,6.11,2068
2916,Lemon Angel (1988),Ecchi,TV,9,6.18,567
2917,Lemon Angel (1988/II),Ecchi,TV,8,6.05,462
2918,Princess Tutu Recaps,"Comedy, Magic, Romance, Shoujo",Special,3,6.75,3999
2919,Ai Yori Aoshi: Enishi - Miyuki,"Comedy, Drama, Romance",Special,1,7.04,12647
2920,Kingdom of Chaos: Born to Kill,Fantasy,OVA,4,6.02,496
2921,Mai-Otome 0: S.ifr,Sci-Fi,OVA,3,7.49,11171
2922,.hack//G.U. Trilogy,"Action, Fantasy, Game, Sci-Fi",Movie,1,7.32,22537
2923,IGPX: Immortal Grand Prix (2005),"Drama, Mecha, Sci-Fi, Shounen, Sports",TV,13,7.24,11386
2924,Bakuto Sengen Daigander,"Adventure, Mecha, Sci-Fi, Shounen",TV,39,6.79,1174
2925,Kinnikuman,"Adventure, Comedy, Shounen, Sports",TV,137,7.35,3623
2926,Kinnikuman (1984),"Action, Comedy, Shounen, Sports",Movie,1,6.63,474
2927,Kinnikuman: Ooabare! Seigi Choujin,"Action, Comedy, Shounen, Sports",Movie,1,6.54,327
2928,Kinnikuman: Seigi Choujin vs. Kodai Choujin,"Action, Comedy, Shounen, Sports",Movie,1,6.44,280
2929,Kinnikuman: Gyakushuu! Uchuu Kakure Choujin,"Action, Comedy, Shounen, Sports",Movie,1,6.41,287
2930,Kinnikuman: Haresugata! Seigi Choujin,"Action, Comedy, Shounen, Sports",Movie,1,6.3,280
2931,Kinnikuman: New York Kiki Ippatsu!,"Action, Comedy, Shounen, Sports",Movie,1,6.42,278
2932,Kinnikuman: Seigi Choujin vs. Senshi Choujin,"Action, Comedy, Shounen, Sports",Movie,1,6.22,282
2933,Kinnikuman: Kessen! Shichinin no Seigi Choujin vs. Uchuu Nobushi,"Action, Comedy, Shounen, Sports",Special,1,6.6,406
2934,Kinnikuman: Kinnikusei Oui Soudatsu-hen,"Action, Comedy, Shounen, Sports",TV,46,7.06,676
2935,Himitsu no Akko-chan,"Magic, School, Shoujo",TV,94,6.49,1085
2936,Gibo no Toiki: Haitoku Kokoro ni Tadayou Haha no Iroka,Hentai,OVA,2,6.79,3536
2937,Tenkuu Danzai Skelter+Heaven,"Mecha, Sci-Fi",OVA,1,2,7680
2938,Gundam Evolve,"Action, Mecha, Military, Space",OVA,15,6.89,6128
2939,Vampiyan Kids,"Comedy, Fantasy, Kids",TV,23,6.35,435
2940,Potemayo Specials,"Comedy, School, Seinen",Special,6,7.45,2975
2941,Gasshin Sentai Mechander Robo,"Mecha, Military, Mystery, Sci-Fi, Space",TV,35,6.28,287
2942,Yatterman,"Adventure, Comedy, Parody",TV,60,6.68,2169
2943,Aria The Origination,"Fantasy, Sci-Fi, Shounen, Slice of Life",TV,13,8.64,56162
2944,Hatenkou Yuugi,"Adventure, Comedy, Drama, Fantasy, Romance, Shoujo",TV,10,7.3,25885
2945,H2O: Footprints in the Sand,"Harem, Romance, School",TV,12,7.26,64975
2946,Romance wa Tsurugi no Kagayaki II,"Action, Comedy, Demons, Fantasy, Hentai",OVA,6,6.36,1019
2947,Septem Charm Magical Kanan,"Hentai, Magic, Romance, School",OVA,4,6.21,1381
2948,Megachu!,"Hentai, Supernatural",OVA,3,6.61,3991
2949,Momiji,"Hentai, School",OVA,4,6.38,1506
2950,Muteki Koujin Daitarn 3,"Mecha, Sci-Fi",TV,40,7.25,1270
2951,Aoki Honoo,"Drama, Romance, Seinen",OVA,1,5.27,1312
2952,Moke Moke Taishou Dendo Musume Arisa,"Hentai, Mecha",OVA,2,6.18,3321
2953,Heartwork: Symphony of Destruction,"Action, Hentai",OVA,3,6.38,2197
2954,Mozu no Nie,"Hentai, Historical, Mystery",OVA,1,5.45,1099
2955,Dr. Slump,"Comedy, Sci-Fi, Shounen, Slice of Life",TV,74,7.11,8735
2956,Montana Jones,"Adventure, Comedy",TV,52,7.1,784
2957,Kikou Keisatsu Metal Jack,"Action, Mecha, Police, Sci-Fi",TV,37,6.41,349
2958,Uchuusen Sagittarius,"Adventure, Sci-Fi",TV,77,6.99,370
2959,Kimi ga Nozomu Eien: Next Season,"Drama, Romance",OVA,4,7.05,21064
2960,Harbor Light Monogatari: Fashion Lala yori,Shoujo,OVA,1,5.49,800
2961,Wagaya no Oinari-sama.,"Adventure, Fantasy, Shounen, Supernatural",TV,24,7.31,23132
2962,Kite Liberator,"Action, Drama, Sci-Fi",OVA,1,6.52,15827
2963,Discode: Ijou Seiai,Hentai,OVA,3,6.38,4289
2964,Yuusha Exkaiser,"Action, Mecha, Sci-Fi, Shounen",TV,48,6.71,648
2965,Inaka Isha,"Dementia, Drama, Historical, Psychological",Movie,1,6.88,10030
2966,Giant Gorg,"Adventure, Mecha, Sci-Fi",TV,26,7.16,1300
2967,School Days: Magical Heart Kokoro-chan,"Comedy, Ecchi, Magic",OVA,1,5.86,28812
2968,Izumo (2003),"Adventure, Comedy, Fantasy, Hentai",OVA,5,6.27,1539
2969,Stop!! Hibari-kun!,Comedy,TV,35,7.12,1355
2970,Jokuana,Hentai,OVA,2,5.85,1137
2971,Haikara-san ga Tooru,"Drama, Historical, Romance, Shoujo, Slice of Life",TV,42,7.39,1155
2972,Mezame no Hakobune,Fantasy,OVA,1,6.21,1867
2973,Mnemosyne: Mnemosyne no Musume-tachi,"Action, Horror, Sci-Fi, Shoujo Ai, Supernatural",TV,6,7.5,96092
2974,Mikan Enikki,"Comedy, Romance, Shoujo, Slice of Life",TV,30,7.38,1096
2975,Kiddy GiRL-AND,"Action, Comedy, Sci-Fi, Super Power",TV,24,6.98,13368
2976,Kininaru Kimochi,Hentai,OVA,4,6.26,1923
2977,Tengen Toppa Gurren Lagann: Mitee Mono wa Miteen da!!,"Action, Adventure, Comedy, Mecha, Sci-Fi",Special,1,7.47,24618
2978,Zombie-Loan Specials,"Action, Shounen, Supernatural",Special,2,7.19,22182
2979,Fortune Dogs,Adventure,TV,39,6.8,400
2980,Mahoutsukai Sally,"Fantasy, Magic, School, Shoujo",TV,109,6.49,1478
2981,Kure-nai,"Comedy, Drama, Martial Arts",TV,12,7.52,59099
2982,Amatsuki,"Action, Fantasy, Historical, Shoujo, Supernatural",TV,13,7.04,41920
2983,UFO Senshi Dai Apolon,"Action, Mecha, Sci-Fi",TV,26,6.43,312
2984,Oshare Majo Love and Berry: Shiawase no Mahou,Magic,Movie,1,5.83,398
2985,RD Sennou Chousashitsu,"Action, Sci-Fi",TV,26,7.24,16331
2986,Persona: Trinity Soul,"Action, Sci-Fi, Super Power",TV,26,6.76,48744
2987,Furusato Japan,Historical,Movie,1,6.94,1464
2988,Shoubushi Densetsu Tetsuya,"Game, Historical, Shounen",TV,20,7.62,3735
2989,Natural: Another,"Hentai, Romance",OVA,2,6.12,1059
2990,"Ginga Eiyuu Densetsu Gaiden: Senoku no Hoshi, Senoku no Hikari","Action, Military, Sci-Fi, Space",OVA,24,8.2,8621
2991,RGB Adventure,Adventure,TV,6,5.21,109
2992,Kirepapa.,"Comedy, Drama, Romance, Yaoi",OVA,2,7.02,30628
2993,Tres Marias: Sannin no Sei Shojo,Hentai,OVA,2,5.57,1003
2994,Leatherman,Hentai,OVA,5,5.99,874
2995,Mikagura Tanteidan,Hentai,OVA,3,6.04,1015
2996,Hana Dorei,Hentai,OVA,2,5.77,930
2997,Fushigi no Umi no Nadia Specials,"Adventure, Sci-Fi",Special,10,6.78,1927
2998,Korashime,Hentai,OVA,2,6.07,1419
2999,Orchid☆Emblem,Hentai,OVA,1,5.68,646
3000,Mi-da-ra,Hentai,OVA,3,5.88,928
3001,Dorei Ichiba,Hentai,OVA,3,6.37,2049
3002,Majokko Megu-chan,"Magic, Shoujo",TV,72,6.75,1139
3003,Bus Gamer,Action,TV,3,6.66,20550
3004,Hoshi no Umi no Amuri,"Adventure, Fantasy, Sci-Fi",OVA,3,5.93,2443
3005,Maicching Machiko-sensei,"Comedy, Ecchi, School",TV,95,6.66,891
3006,Kiniro no Corda: Primo Passo - Hitonatsu no Encore,"Harem, Music, Romance, School, Shoujo",Special,1,7.59,17967
3007,Dark,Hentai,OVA,2,5.75,1310
3008,Kimagure Orange☆Road: Shounen Jump Special,"Drama, Romance, Shounen",OVA,1,6.79,1942
3009,Gloria: Kindan no Ketsuzoku,"Drama, Hentai, Mystery, Romance",OVA,3,5.61,654
3010,Shin Hurricane Polymar,"Action, Martial Arts, Sci-Fi, Super Power",OVA,2,6.14,752
3011,Rokushin Gattai GodMars,"Action, Mecha, Sci-Fi, Space",TV,64,6.52,917
3012,Aru Tabibito no Nikki Specials,"Adventure, Fantasy",Special,3,6.55,5473
3013,Sexy Sailor Soldiers,"Action, Comedy, Hentai, Super Power",OVA,1,5.72,1273
3014,The Guts!,Hentai,OVA,2,6.38,2890
3015,iDOLM@STER Xenoglossia Specials,"Comedy, Mecha, Sci-Fi",Special,9,6.26,2377
3016,Blassreiter,"Action, Sci-Fi",TV,24,7.07,55444
3017,Sky Girls Specials,"Comedy, Mecha, Military, Sci-Fi",Special,9,6.67,3008
3018,Haitoku no Shoujo,"Hentai, Psychological",OVA,2,5.9,1696
3019,Hula Kappa,Comedy,TV,78,6.09,168
3020,Yawaraka Sangokushi Tsukisase!! Ryofuko-chan,"Comedy, Ecchi, Magic",OVA,4,6.51,3560
3021,Jungle no Ouja Taa-chan,"Action, Comedy, Parody",TV,50,7.35,801
3022,Sumomomo Momomo: Chijou Saikyou no Yome Specials,"Comedy, Ecchi, Martial Arts, Romance",Special,2,7.08,7082
3023,Shigofumi,"Drama, Fantasy, Psychological, Supernatural, Thriller",TV,12,7.62,54000
3024,Kodomo no Omocha,"Comedy, Drama, School, Shoujo",OVA,1,7.24,3118
3025,Donburi Kazoku,Hentai,OVA,2,5.98,2457
3026,Porphy no Nagai Tabi,"Drama, Historical, Kids, Slice of Life",TV,52,7.11,1335
3027,Meiken Lassie,"Adventure, Kids, Slice of Life",TV,26,6.92,309
3028,Oni-Tensei,"Hentai, Horror, Supernatural",OVA,4,6.44,1387
3029,Injuu vs. Onna Spy,"Hentai, Horror",OVA,1,5.66,667
3030,Blame! Special,"Mecha, Sci-Fi",Special,1,5.61,4087
3031,Blame! Prologue,"Action, Mecha, Sci-Fi",OVA,2,5.85,4703
3032,Chou Mashin Eiyuuden Wataru,"Action, Adventure, Comedy, Mecha",TV,51,7.16,615
3033,Go-Q-Choji Ikkiman,"Sci-Fi, Sports",TV,32,6.65,295
3034,Hey! Bumboo,"Adventure, Cars, Kids",TV,130,6.2,677
3035,Joou Heika no Petite Angie,"Historical, Mystery, Shoujo",TV,26,6.65,451
3036,Meme Iroiro Yume no Tabi,"Adventure, Kids, Sci-Fi",TV,127,6.67,317
3037,Mister Ajikko,"Comedy, Shounen",TV,99,7.31,1828
3038,Moero! Top Striker,"Action, Shounen, Sports",TV,49,6.79,2072
3039,Darcrows,Hentai,OVA,2,5.86,1624
3040,Ninpou Midare Karakuri,Hentai,OVA,2,6.24,1254
3041,The Ultraman,"Action, Sci-Fi, Shounen, Space, Super Power",TV,50,6.53,737
3042,Biohazard: Degeneration,"Action, Horror, Sci-Fi",Movie,1,7.19,20172
3043,Ghost in the Shell: Stand Alone Complex - Solid State Society - Uchikoma no Hibi,"Comedy, Mecha, Sci-Fi",Special,1,7.19,8937
3044,Mad★Bull 34,"Action, Police",OVA,4,6.34,3216
3045,Kamichu! Specials,"Comedy, Drama, Slice of Life, Supernatural",Special,4,7.6,6978
3046,Space Oz no Bouken,"Adventure, Sci-Fi",TV,26,6.25,151
3047,Onna Kyoushi,Hentai,OVA,3,6.24,1570
3048,Kowaremono,Hentai,OVA,3,5.8,1445
3049,To LOVE-Ru,"Comedy, Ecchi, Harem, Romance, School, Sci-Fi",TV,26,7.34,237563
3050,Candy☆Boy: Side Story For Archive,"Romance, School, Shoujo Ai",ONA,1,7.02,20294
3051,Vampire Knight,"Drama, Mystery, Romance, Shoujo, Supernatural, Vampire",TV,13,7.4,286826
3052,Pi Po Pa Po Patrol-kun,"Comedy, Kids",TV,65,6.05,153
3053,Bosco Daibouken,"Adventure, Fantasy, Kids",TV,26,7.24,699
3054,Gensou Jotan Ellcia,"Adventure, Fantasy",OVA,4,6.07,940
3055,Minky Momo in Yume ni Kakeru Hashi,"Drama, Shoujo, Slice of Life",OVA,1,7,600
3056,A.LI.CE,Sci-Fi,Movie,1,5.38,1034
3057,Kemeko Deluxe!,"Action, Comedy, Ecchi, Romance, School, Sci-Fi, Shounen",TV,12,6.75,26991
3058,Nagasaki 1945: Angelus no Kane,"Drama, Historical, Military",Movie,1,6.61,346
3059,Kino no Tabi: The Beautiful World - Tou no Kuni,"Adventure, Fantasy, Psychological",Special,1,7.75,19211
3060,Nogizaka Haruka no Himitsu,"Comedy, Romance",TV,12,7.35,80820
3061,Maria-sama ga Miteru Specials,"Drama, Romance, School, Shoujo, Shoujo Ai, Slice of Life",Special,7,7.55,6085
3062,Maria-sama ga Miteru: Haru Specials,"Drama, Romance, School, Shoujo, Shoujo Ai, Slice of Life",Special,6,7.51,5554
3063,Special A,"Comedy, Romance, School, Shoujo",TV,24,7.78,173603
3064,Tenrankai no E,Comedy,Movie,1,6.46,1065
3065,Souseiki,Parody,Movie,1,5.77,959
3066,Push,Parody,Special,1,6.46,1272
3067,Muramasa,"Historical, Horror, Martial Arts, Samurai",Movie,1,6.39,2535
3068,Mrs. Junkie,Hentai,OVA,2,6.85,3817
3069,Taimanin Asagi,"Action, Demons, Hentai, Martial Arts, Supernatural",OVA,4,7.02,7603
3070,Nayuta,"Action, Sci-Fi, Shoujo",OVA,1,6.04,549
3071,Grendizer: Getter Robo G - Great Mazinger Kessen! Daikaijuu,"Action, Mecha, Sci-Fi, Shounen",Movie,1,6.77,1179
3072,Madonna,"Comedy, School, Sports",OVA,2,6.47,849
3073,Maison Ikkoku: Utsuriyuku Kisetsu no Naka de,"Comedy, Drama, Romance",OVA,1,7.15,1458
3074,Maison Ikkoku: Prelude - Meguru Haru no Sakura no you ni...,"Comedy, Drama, Romance",Special,1,7.1,1672
3075,Ghost in the Shell: Stand Alone Complex 2nd GIG - Tachikoma na Hibi,"Comedy, Mecha, Sci-Fi",Special,26,7.37,14240
3076,Yuusha Tokkyuu Might Gaine,"Action, Adventure, Mecha, Sci-Fi, Shounen",TV,47,7.18,1021
3077,Genji Monogatari,"Drama, Historical, Romance",Movie,1,6.72,2773
3078,Rayca,Sci-Fi,OVA,1,4.95,841
3079,Ryuusei no Rockman Tribe,Adventure,TV,21,7.14,3510
3080,Ougon no Hou: El Cantare no Rekishikan,"Fantasy, Historical",Movie,1,5.83,308
3081,Steady x Study,Romance,OVA,1,4.7,310
3082,Shin Onimusha: Dawn of Dreams the Story,"Action, Demons, Historical, Martial Arts, Samurai",OVA,1,6,695
3083,DinoZone,"Adventure, Sci-Fi, Shounen",OVA,5,5.9,636
3084,"Yume Miru, Anime: on-chan",Comedy,TV,26,7,116
3085,Wellber no Monogatari: Sisters of Wellber Zwei,"Adventure, Fantasy, Historical, Romance",TV,13,7,3038
3086,Kanokon,"Comedy, Ecchi, Harem, Romance, School, Shounen, Slice of Life, Supernatural",TV,12,6.74,122288
3087,Yuusha Shirei Dagwon,"Action, Adventure, Martial Arts, Mecha, School, Super Power",TV,48,7.21,689
3088,Connected,"Dementia, Music, Sci-Fi",Music,1,6.24,2697
3089,Survival,"Dementia, Drama, Music, Psychological, School, Supernatural",Music,1,6.42,2153
3090,Genius Party,"Action, Dementia, Fantasy, Mecha, Music, Psychological, Romance, Sci-Fi",Movie,7,7.39,18612
3091,Riki-Oh: Toukatsu Jigoku,"Action, Martial Arts, Seinen, Super Power",OVA,1,6.25,1319
3092,Riki-Oh 2: Horobi no Ko,"Action, Martial Arts, Seinen, Super Power",OVA,1,5.67,725
3093,Tenshi Nanka ja Nai,"Comedy, Drama",OVA,1,6.38,2027
3094,Tanjou: Debut,"Romance, Slice of Life, Supernatural",OVA,2,5.19,392
3095,Noramimi,Comedy,TV,12,6.9,406
3096,Saint Seiya: Meiou Hades Elysion-hen,"Action, Fantasy, Shounen, Super Power",OVA,6,7.82,19044
3097,Hal &amp; Bons,"Comedy, Slice of Life",OVA,5,5.28,356
3098,New Hal &amp; Bons,"Comedy, Slice of Life",OVA,9,5.55,174
3099,Ginga no Uo Ursa Minor Blue,"Fantasy, Kids",OVA,1,6.33,1568
3100,Garakuta-doori no Stain,Comedy,TV,13,7.02,641
3101,Choujin Locke,"Action, Sci-Fi, Super Power",Movie,1,6.65,1250
3102,Extra,"Action, Dementia, Horror, Music, Sci-Fi",Music,1,6.14,2401
3103,Mahou Shoujo Meruru,"Adventure, Fantasy, Hentai, Magic",OVA,2,5.73,1232
3104,Lesbian Byoutou,Hentai,OVA,2,5.54,1149
3105,Kowaremono II,Hentai,OVA,2,5.93,988
3106,Virtuacall 2,Hentai,OVA,2,5.48,411
3107,Shinjin Tour Conductor,Hentai,OVA,1,5.51,862
3108,Shino-sensei no Yuuwaku Jugyou,Hentai,OVA,1,6.12,1388
3109,Gakuentoshi Varanoir Joukan,"Action, Magic",OVA,2,4.25,769
3110,Seijuuden: Twin Dolls,"Action, Demons, Hentai, Magic, Supernatural",OVA,2,5.9,897
3111,Neko Ramen,Comedy,ONA,13,6.55,2059
3112,Youshou,"Demons, Hentai, Horror",OVA,2,5.4,745
3113,Cleavage,Hentai,OVA,2,6.74,6250
3114,Dorei Kaigo,Hentai,OVA,3,6.32,1959
3115,Utsukushiki Emono-tachi no Gakuen,Hentai,OVA,2,5.58,1072
3116,Henbou Moral Hazard,Hentai,OVA,1,4.88,552
3117,Kouin Tenshi: Haitoku no Lycéenne,Hentai,OVA,1,4.99,652
3118,Mechiku,Hentai,OVA,1,5.26,522
3119,Kiss yori...,Hentai,OVA,3,6.03,1312
3120,Kochira Katsushikaku Kameari Kouenmae Hashutsujo (TV),"Comedy, Police, Slice of Life",TV,373,7.82,4734
3121,Kochira Katsushikaku Kameari Kouenmae Hashutsujo,"Comedy, Police",Special,1,6.53,323
3122,Kochira Katsushikaku Kameari Kouenmae Hashutsujo The Movie 2: UFO Shuurai! Tornado Daisakusen,"Comedy, Police",Movie,1,6.99,504
3123,Allison to Lillia,"Action, Adventure, Shounen",TV,26,7.41,27571
3124,Midori no Makibao,"Comedy, Sports",TV,61,6.73,488
3125,Dragon Rider,Hentai,OVA,2,5.85,1049
3126,Reyon Densetsu Flair,"Action, Demons, Fantasy, Hentai",OVA,2,5.41,556
3127,Soukan Rensa,Hentai,OVA,1,5.82,902
3128,Shoujo Auction,Hentai,OVA,2,6.12,1278
3129,Doukyuusei (OVA): Natsu no Owari ni,"Drama, Harem, Hentai, Romance",OVA,4,5.87,1114
3130,Stringendo: Angel-tachi no Private Lesson,Hentai,OVA,12,7.55,7713
3131,Karen,Hentai,OVA,1,5.97,1791
3132,Dennou Boukenki Webdiver,"Adventure, Mecha, Sci-Fi, Shounen",TV,52,7.12,876
3133,Chu^2,Hentai,OVA,1,5.3,798
3134,Momone,Hentai,OVA,1,5.38,838
3135,Pianist,Hentai,OVA,1,5.21,583
3136,U-Jin Brand,Hentai,OVA,1,5.67,535
3137,Hika Ryoujoku: Wana ni Hamatta Futari,Hentai,OVA,1,5.32,1062
3138,Renzu: Futari no Kyori,Hentai,OVA,1,5.48,567
3139,Ganbarist! Shun,"Comedy, Shounen, Sports",TV,30,7.43,1700
3140,Injuu Seisen: Twin Angels,"Hentai, Horror",OVA,4,6,1169
3141,Yadosagashi,"Adventure, Fantasy, Kids, Slice of Life",Special,1,6.6,1113
3142,Mach GoGoGo (1997),"Adventure, Cars",TV,34,6.43,1545
3143,Macross F,"Action, Mecha, Military, Music, Romance, Sci-Fi, Space",TV,25,8.02,95551
3144,Moegaku★5,"Magic, Parody",TV,40,5.93,572
3145,Switch,"Action, Mystery, Police",OVA,2,7.12,17871
3146,Sugai-kun to Kazoku Ishi The Movie,"Comedy, Parody",Movie,1,6.89,92
3147,Kodai Ouja Kyouryuu King,"Adventure, Fantasy, Kids",TV,49,6.14,4402
3148,Kyouran Kazoku Nikki,"Comedy, Sci-Fi",TV,26,7.36,20883
3149,Daraku: Onna Kyoushi Hakai,Hentai,OVA,3,6.21,2338
3150,Getter Robo,"Action, Mecha, Sci-Fi, Shounen",TV,51,7.07,2938
3151,Ijoku,Hentai,OVA,2,5.77,1176
3152,Requiem,Hentai,OVA,2,5.36,2413
3153,Mashou no Kao,Hentai,OVA,1,6.29,1391
3154,Endless Serenade,Hentai,OVA,1,5.88,1034
3155,Injuu Nerawareta Idol,"Demons, Hentai",OVA,1,4.95,652
3156,Isaku,Hentai,OVA,3,5.78,946
3157,Isaku: Respect,Hentai,OVA,3,5.73,1138
3158,Soul Eater,"Action, Adventure, Comedy, Fantasy, Shounen, Supernatural",TV,51,8.08,580184
3159,Utawarerumono OVA,"Action, Comedy, Fantasy",OVA,3,7.29,13738
3160,Tears to Tiara,"Action, Adventure, Fantasy, Magic",TV,26,7.31,50455
3161,Kujakuou,"Action, Demons, Horror",OVA,3,6.22,949
3162,Lightning Trap: Leina &amp; Laika,"Action, Sci-Fi",OVA,1,5.45,406
3163,Fantasia,"Comedy, Drama, Fantasy, Magic, Romance",OVA,1,5.58,877
3164,Shin Kujakuou,"Action, Demons, Horror",OVA,2,6.28,743
3165,Sengoku Kitan Youtouden,"Action, Demons, Martial Arts",OVA,3,6.2,982
3166,Ginga Tetsudou 999: Eternal Fantasy,"Action, Drama, Sci-Fi, Space",Movie,1,6.87,1896
3167,JoJo no Kimyou na Bouken: Phantom Blood,"Action, Adventure, Horror, Shounen, Vampire",Movie,1,7.77,8534
3168,Hidamari Sketch x 365,"Comedy, School, Slice of Life",TV,13,7.9,19180
3169,Princess Army: Wedding★Combat,"Action, Martial Arts, Romance, Shoujo",OVA,2,5.48,603
3170,Kikou Kantai Dairugger XV,"Action, Adventure, Mecha, Sci-Fi, Shounen",TV,52,6.58,1121
3171,Toshokan Sensou,"Action, Comedy, Military, Romance",TV,12,7.6,38882
3172,Yakushiji Ryouko no Kaiki Jikenbo,"Mystery, Police, Supernatural",TV,13,7.19,11002
3173,Neo Angelique Abyss,"Comedy, Fantasy, Harem, Romance, Shoujo",TV,13,7.01,24149
3174,Kamen no Maid Guy,"Action, Comedy, Ecchi, Super Power",TV,12,7.14,27761
3175,Moyashimon: Kin Gekijou Deluxe,Comedy,Special,4,6.87,4783
