anime_id,name,genre,type,episodes,rating,members
1,Cowboy Bebop,"Action, Adventure, Comedy, Drama, Sci-Fi, Space",TV,26,8.82,486824
2,Cowboy Bebop: Tengoku no Tobira,"Action, Drama, Mystery, Sci-Fi, Space",Movie,1,8.4,137636
3,Trigun,"Action, Comedy, Sci-Fi",TV,26,8.32,283069
4,Witch Hunter Robin,"Action, Drama, Magic, Mystery, Police, Supernatural",TV,26,7.36,64905
5,Beet the Vandel Buster,"Adventure, Fantasy, Shounen, Supernatural",TV,52,7.06,9848
6,Eyeshield 21,"Action, Comedy, Shounen, Sports",TV,145,8.08,83648
7,Hachimitsu to Clover,"Comedy, Drama, Josei, Romance",TV,24,8.18,130646
8,Hungry Heart: Wild Striker,"Comedy, Shounen, Slice of Life, Sports",TV,52,7.74,13469
9,Initial D Fourth Stage,"Action, Cars, Drama, Seinen, Sports",TV,24,8.24,41584
10,Monster,"Drama, Horror, Mystery, Police, Psychological, Seinen, Thriller",TV,74,8.72,247562
11,Naruto,"Action, Comedy, Martial Arts, Shounen, Super Power",TV,220,7.81,683297
12,One Piece,"Action, Adventure, Comedy, Drama, Fantasy, Shounen, Super Power",TV,Unknown,8.58,504862
13,Prince of Tennis,"Action, Comedy, School, Shounen, Sports",TV,178,8.04,87643
14,Ring ni Kakero 1,"Action, Shounen, Sports",TV,12,6.7,2224
15,School Rumble,"Comedy, Romance, School, Shounen",TV,26,8.06,178553
16,Sunabouzu,"Action, Adventure, Comedy, Ecchi, Sci-Fi, Shounen",TV,24,7.55,65516
17,Texhnolyze,"Action, Drama, Psychological, Sci-Fi",TV,22,7.78,95859
18,Trinity Blood,"Action, Supernatural, Vampire",TV,24,7.44,113791
19,Yakitate!! Japan,"Comedy, Shounen",TV,69,8.05,50876
20,Zipang,"Action, Drama, Historical, Military, Sci-Fi, Seinen",TV,26,7.56,8630
21,Neon Genesis Evangelion,"Action, Dementia, Drama, Mecha, Psychological, Sci-Fi",TV,26,8.32,461946
22,Neon Genesis Evangelion: Death &amp; Rebirth,"Drama, Mecha, Psychological, Sci-Fi",Movie,1,7.51,102093
23,Neon Genesis Evangelion: The End of Evangelion,"Dementia, Drama, Mecha, Psychological, Sci-Fi",Movie,1,8.45,215630
24,Berserk,"Action, Adventure, Demons, Drama, Fantasy, Horror, Military, Romance, Seinen, Supernatural",TV,25,8.4,226430
25,Ghost in the Shell,"Action, Mecha, Police, Psychological, Sci-Fi, Seinen",Movie,1,8.34,223036
26,Rurouni Kenshin: Meiji Kenkaku Romantan - Tsuioku-hen,"Action, Drama, Historical, Martial Arts, Romance, Samurai",OVA,4,8.83,129307
27,Rurouni Kenshin: Meiji Kenkaku Romantan,"Action, Adventure, Comedy, Historical, Romance, Samurai",TV,94,8.43,218928
28,Rurouni Kenshin: Meiji Kenkaku Romantan - Ishinshishi e no Chinkonka,"Drama, Historical, Samurai, Shounen",Movie,1,7.65,33191
29,Akira,"Action, Adventure, Horror, Military, Sci-Fi, Supernatural",Movie,1,8.15,215897
30,.hack//Sign,"Adventure, Fantasy, Game, Magic, Mystery, Sci-Fi",TV,26,7.14,110304
31,Aa! Megami-sama!,"Comedy, Magic, Romance, Seinen, Supernatural",OVA,5,7.41,34590
32,Aa! Megami-sama! (TV),"Comedy, Magic, Romance, Seinen, Supernatural",TV,24,7.45,96694
33,Tenshi Kinryouku,"Action, Drama, Romance, Shoujo, Supernatural",OVA,3,6.46,36352
34,Kidou Tenshi Angelic Layer,"Comedy, Drama, Sci-Fi, Shounen, Sports",TV,26,7.32,39758
35,Ai Yori Aoshi,"Comedy, Drama, Harem, Romance, Slice of Life",TV,24,7.24,66597
36,Appleseed (Movie),"Action, Drama, Mecha, Military, Police, Sci-Fi, Shounen",Movie,1,7.21,49553
37,Arc the Lad,"Action, Adventure, Fantasy, Horror, Sci-Fi",TV,26,6.62,10392
38,Avenger,"Adventure, Fantasy, Sci-Fi, Shounen",TV,13,6.02,12286
39,Beck,"Comedy, Drama, Music, Shounen, Slice of Life",TV,26,8.4,148328
40,Blue Gender,"Adventure, Drama, Horror, Mecha, Military, Romance, Sci-Fi, Space",TV,26,7.13,40581
41,Chobits,"Comedy, Drama, Ecchi, Romance, Sci-Fi, Seinen",TV,26,7.57,266846
42,Chrno Crusade,"Action, Demons, Historical, Romance, Supernatural",TV,24,7.8,140865
43,D.N.Angel,"Action, Comedy, Fantasy, Magic, Romance, School, Shoujo",TV,26,7.35,126914
44,D.C.: Da Capo,"Drama, Harem, Magic, Romance",TV,26,6.93,49909
45,DearS,"Comedy, Ecchi, Harem, Romance, Sci-Fi",TV,12,6.8,91037
46,Rozen Maiden,"Action, Comedy, Drama, Magic, Seinen",TV,12,7.57,128688
47,Rozen Maiden: Träumend,"Action, Comedy, Drama, Magic, Seinen",TV,12,7.78,72645
48,Azumanga Daioh,"Comedy, School, Slice of Life",TV,26,8.06,170901
49,Basilisk: Kouga Ninpou Chou,"Action, Adventure, Fantasy, Historical, Romance, Samurai, Supernatural",TV,24,7.68,98144
50,Black Cat,"Adventure, Comedy, Sci-Fi, Shounen, Super Power",TV,23,7.52,150512
51,Cluster Edge,"Action, Fantasy, Military, Sci-Fi",TV,25,6.48,6995
52,Full Metal Panic!,"Action, Comedy, Mecha, Military, Sci-Fi",TV,24,7.81,256325
53,Full Metal Panic? Fumoffu,"Action, Comedy, School",TV,12,8.21,171086
54,Full Metal Panic! The Second Raid,"Action, Mecha, Military",TV,13,8.06,155340
55,Gakuen Alice,"Comedy, Magic, School, Shoujo",TV,26,7.8,52995
56,Soukyuu no Fafner: Dead Aggressor,"Action, Drama, Mecha, Military, Sci-Fi",TV,25,7.38,27516
57,Mahou Shoujo Lyrical Nanoha,"Action, Comedy, Drama, Magic, Super Power",TV,13,7.52,62582
58,Mahou Shoujo Lyrical Nanoha A&#039;s,"Action, Comedy, Drama, Magic, Super Power",TV,13,8.1,41685
59,Shuffle!,"Comedy, Drama, Ecchi, Fantasy, Harem, Magic, Romance, School, Seinen",TV,24,7.31,158772
60,Mobile Suit Gundam,"Action, Mecha, Military, Sci-Fi, Space",TV,43,7.89,51566
61,Mobile Suit Gundam: The 08th MS Team,"Adventure, Drama, Mecha, Military, Romance, Sci-Fi",OVA,12,8.13,34177
62,Mobile Suit Gundam 0080: War in the Pocket,"Adventure, Drama, Mecha, Military, Sci-Fi, Space",OVA,6,7.85,22609
63,Mobile Suit Gundam: The 08th MS Team - Miller&#039;s Report,"Drama, Mecha, Military, Romance, Sci-Fi",Movie,1,6.95,8078
64,Mobile Suit Gundam 0083: Stardust Memory,"Adventure, Drama, Mecha, Military, Sci-Fi, Space",OVA,13,7.47,20238
65,Mobile Suit Zeta Gundam,"Drama, Mecha, Military, Sci-Fi, Space",TV,50,8.03,28959
66,Mobile Suit Gundam ZZ,"Comedy, Drama, Mecha, Military, Sci-Fi, Space",TV,47,6.81,17517
67,Mobile Suit Gundam: Char&#039;s Counterattack,"Drama, Mecha, Military, Sci-Fi, Space",Movie,1,7.81,19258
68,Mobile Suit Gundam F91,"Drama, Mecha, Military, Sci-Fi, Space",Movie,1,6.9,13456
69,Mobile Suit Victory Gundam,"Drama, Mecha, Military, Sci-Fi, Space",TV,51,6.98,12673
70,Mobile Suit Gundam Wing,"Action, Drama, Mecha, Military, Sci-Fi, Space",TV,49,7.87,86001
71,Mobile Suit Gundam Wing: Endless Waltz,"Action, Drama, Mecha, Military, Sci-Fi, Space",OVA,3,7.87,28485
72,After War Gundam X,"Adventure, Drama, Mecha, Sci-Fi, Space",TV,39,7.39,19132
73,Mobile Suit Gundam Seed,"Action, Drama, Mecha, Military, Romance, Sci-Fi, Space",TV,50,7.93,96973
74,Mobile Suit Gundam Seed Destiny,"Action, Drama, Mecha, Military, Romance, Sci-Fi, Space",TV,50,7.36,65896
75,Turn A Gundam,"Action, Adventure, Drama, Mecha, Military, Sci-Fi, Space",TV,50,7.76,20056
76,Mobile Fighter G Gundam,"Adventure, Comedy, Drama, Martial Arts, Mecha, Romance, Sci-Fi, Space, Sports",TV,49,7.62,36338
77,Last Exile,"Action, Adventure, Sci-Fi",TV,26,7.94,104193
78,Mai-HiME,"Action, Comedy, Drama, Fantasy, Magic, Mecha, Romance, School, Shoujo Ai",TV,26,7.59,76492
79,Mai-Otome,"Comedy, Drama, Fantasy, Magic",TV,26,7.4,36924
80,Shin Shirayuki-hime Densetsu Prétear,"Comedy, Drama, Fantasy, Magic, Romance, Shoujo, Super Power",TV,13,7.33,37394
81,Air,"Drama, Romance, Slice of Life, Supernatural",TV,13,7.48,188861
82,Aishiteruze Baby★★,"Comedy, Drama, Romance, Shoujo",TV,26,7.58,63959
83,Akazukin Chacha,"Adventure, Comedy, Fantasy, Magic, Romance, Shoujo",TV,74,7.48,7581
84,Ayashi no Ceres,"Adventure, Comedy, Drama, Horror, Psychological, Romance, Shoujo, Supernatural",TV,24,7.38,38336
85,Boys Be...,"Comedy, Romance, Shounen, Slice of Life",TV,13,6.59,15026
86,Hana yori Dango,"Drama, Romance, School, Shoujo",TV,51,7.9,28341
87,Ou Dorobou Jing,"Adventure, Comedy, Fantasy, Sci-Fi, Shounen",TV,13,7.34,21920
88,Ou Dorobou Jing in Seventh Heaven,"Adventure, Comedy, Fantasy, Psychological, Shounen",OVA,3,7.43,8561
89,Bakuretsu Tenshi,"Adventure, Comedy, Mecha, Sci-Fi",TV,24,6.94,48551
90,Chuuka Ichiban!,"Action, Comedy, Drama, Shounen",TV,52,7.69,8586
91,Corrector Yui,"Adventure, Comedy, Magic, Sci-Fi",TV,52,6.9,7411
92,Chou Henshin Cosprayers,"Action, Adventure, Comedy, Ecchi, Fantasy, Magic, Sci-Fi, Super Power",TV,8,5.11,5555
93,Uchuu no Stellvia,"Action, Romance, Sci-Fi, Space",TV,26,7.49,15471
94,Sakigake!! Cromartie Koukou,"Comedy, School, Shounen",TV,26,8.02,67254
95,El Hazard: The Alternative World,"Adventure, Comedy, Fantasy",TV,13,6.94,7131
96,El Hazard: The Wanderers,"Adventure, Comedy, Fantasy, Romance",TV,26,7.1,9289
97,El Hazard: The Magnificent World,"Adventure, Comedy, Fantasy, Romance",OVA,7,7.44,10130
98,El Hazard 2: The Magnificent World,"Adventure, Comedy, Fantasy",OVA,4,6.99,5771
99,Final Approach,"Comedy, Drama, Romance, Slice of Life",TV,13,6.69,24902
100,Fruits Basket,"Comedy, Drama, Fantasy, Romance, Shoujo, Slice of Life",TV,26,7.8,242553
101,Fullmetal Alchemist,"Action, Adventure, Comedy, Drama, Fantasy, Magic, Military, Shounen",TV,51,8.33,600384
102,Full Moon wo Sagashite,"Comedy, Drama, Music, Romance, Shoujo, Supernatural",TV,52,8.08,59374
103,Fushigi Yuugi,"Adventure, Comedy, Drama, Fantasy, Historical, Magic, Martial Arts, Romance, Shoujo",TV,52,7.77,61622
104,Fushigi Yuugi: Eikouden,"Adventure, Drama, Fantasy, Romance, Shoujo",OVA,4,7,11740
105,Futakoi,"Comedy, Romance, School",TV,13,6.64,23968
106,Futakoi Alternative,"Comedy, Drama, Romance",TV,13,7.02,21516
107,Gate Keepers,"Action, Comedy, Fantasy, Mecha, Sci-Fi, Shounen",TV,24,7.07,14582
108,Gate Keepers 21,"Action, Drama, Mecha, Sci-Fi, Shounen",OVA,6,6.9,7363
109,Gensoumaden Saiyuuki,"Adventure, Comedy, Drama, Shounen, Supernatural",TV,50,7.71,31179
110,Saiyuuki Reload,"Action, Adventure, Comedy, Drama, Fantasy, Shoujo",TV,25,7.54,16298
111,Saiyuuki Reload Gunlock,"Action, Adventure, Comedy, Fantasy, Shoujo",TV,26,7.56,11233
112,GetBackers,"Action, Comedy, Drama, Mystery, Shounen, Super Power, Supernatural",TV,49,7.73,73536
113,Green Green,"Comedy, Ecchi, Romance, School, Slice of Life",TV,12,6.44,80562
114,Gunslinger Girl,"Action, Drama, Military, Psychological, Sci-Fi",TV,13,7.55,106865
115,Hikaru no Go,"Comedy, Game, Shounen, Supernatural",TV,75,8.19,69000
116,Hunter x Hunter,"Action, Adventure, Shounen, Super Power",TV,62,8.48,166255
117,Hunter x Hunter OVA,"Action, Adventure, Shounen, Super Power",OVA,8,8.41,53168
118,Hunter x Hunter: Greed Island,"Action, Adventure, Shounen, Super Power",OVA,8,8.33,57029
119,Hunter x Hunter: Greed Island Final,"Action, Adventure, Shounen, Super Power",OVA,14,8.41,55787
120,Jinki:Extend,"Mecha, Sci-Fi",TV,12,6.29,7496
121,Kamikaze Kaitou Jeanne,"Adventure, Comedy, Demons, Drama, Fantasy, Magic, Mystery, Romance, Shoujo",TV,44,7.52,31081
122,Kannazuki no Miko,"Drama, Magic, Mecha, Romance, Shoujo Ai, Shounen, Supernatural",TV,12,7.05,42927
123,Kanon,"Drama, Romance, Slice of Life, Supernatural",TV,13,7.27,41960
124,Kareshi Kanojo no Jijou,"Comedy, Drama, Romance, School, Shoujo, Slice of Life",TV,26,7.66,94165
125,Kono Minikuku mo Utsukushii Sekai,"Comedy, Drama, Magic, Romance, Sci-Fi",TV,12,6.92,41756
126,Kimi ga Nozomu Eien,"Drama, Romance, Slice of Life",TV,14,7.41,90379
127,Kita e.: Diamond Dust Drops,"Drama, Romance, Slice of Life",TV,12,6.77,5736
128,Loveless,"Action, Drama, Fantasy, Mystery, Romance, Shoujo, Shounen Ai, Supernatural",TV,12,7.19,85554
129,Blood+,"Action, Drama, Horror, Military, Mystery, Supernatural, Vampire",TV,50,7.8,208321
130,Re: Cutie Honey,"Action, Comedy, Ecchi, Sci-Fi, Shoujo Ai",OVA,3,7.16,10378
131,Solty Rei,"Action, Sci-Fi, Super Power",TV,24,7.38,17943
132,Juuni Kokuki,"Action, Adventure, Fantasy, Magic, Supernatural",TV,45,8.16,66646
133,Shaman King,"Action, Adventure, Comedy, Drama, Shounen, Supernatural",TV,64,7.83,169517
134,X/1999,"Action, Drama, Fantasy, Horror, Magic, Sci-Fi, Supernatural",Movie,1,6.68,23038
135,X,"Action, Drama, Fantasy, Magic, Romance, Shoujo, Super Power",TV,24,7.56,51004
136,Mahou Sensei Negima!,"Comedy, Ecchi, Fantasy, Harem, Magic, Romance, School, Shounen, Super Power, Supernatural",TV,26,7.11,76253
137,Maria-sama ga Miteru,"Drama, Romance, Shoujo, Shoujo Ai, Slice of Life",TV,13,7.48,33989
138,Boukyaku no Senritsu,"Adventure, Fantasy, Horror, Mecha, Psychological, Sci-Fi, Shounen, Space, Supernatural",TV,24,6.44,12169
139,"Ima, Soko ni Iru Boku","Adventure, Drama, Fantasy, Military, Sci-Fi",TV,13,7.81,56839
140,Peace Maker Kurogane,"Action, Comedy, Historical, Samurai, Shounen",TV,24,7.43,35123
141,Pita Ten,"Comedy, Fantasy, Kids, Romance, School, Shounen",TV,26,7.08,16047
142,Power Stone,"Adventure, Comedy, Fantasy, Historical, Shounen",TV,26,6.57,4308
143,Mononoke Hime,"Action, Adventure, Fantasy",Movie,1,8.81,339556
144,RahXephon,"Action, Drama, Mecha, Music, Mystery, Psychological, Romance, Sci-Fi",TV,26,7.55,66751
145,Samurai 7,"Historical, Mecha, Samurai, Sci-Fi",TV,26,7.6,74991
146,Scrapped Princess,"Adventure, Comedy, Drama, Fantasy, Mecha, Sci-Fi, Shounen",TV,24,7.52,54575
147,s.CRY.ed,"Action, Adventure, Drama, Sci-Fi, Super Power",TV,26,7.45,52784
148,Shingetsutan Tsukihime,"Action, Horror, Mystery, Romance, Super Power, Supernatural, Vampire",TV,12,7.1,90713
149,Slam Dunk,"Comedy, Drama, School, Shounen, Sports",TV,101,8.56,82570
150,Strange Dawn,"Adventure, Drama, Fantasy",TV,13,6.59,1865
151,Tactics,"Comedy, Drama, Fantasy, Mystery, Shounen, Super Power",TV,25,7.34,27358
152,Tenjou Tenge,"Action, Comedy, Ecchi, Martial Arts, School, Shounen, Super Power",TV,24,7.1,103449
153,Tokyo Underground,"Action, Adventure, Romance, Sci-Fi, Shounen, Super Power",TV,26,6.74,17920
154,Triangle Heart: Sweet Songs Forever,"Adventure, Romance",OVA,4,6.32,4543
155,Tsubasa Chronicle,"Action, Adventure, Fantasy, Magic, Romance, Shounen, Supernatural",TV,26,7.67,134705
156,Ultra Maniac,"Comedy, Magic, Romance, School, Shoujo",TV,26,7.3,20062
157,Ultra Maniac OVA,"Comedy, Magic, Romance, School",OVA,1,6.82,3979
158,Vandread,"Action, Ecchi, Mecha, Sci-Fi, Shounen, Space",TV,13,7.33,53360
159,Vandread: The Second Stage,"Action, Ecchi, Mecha, Sci-Fi, Shounen, Space",TV,13,7.54,36264
160,Tenkuu no Escaflowne,"Adventure, Fantasy, Mecha, Romance, Shoujo",TV,26,7.8,83437
161,Whistle!,"School, Shounen, Sports",TV,39,7.53,8040
162,Xenosaga The Animation,"Action, Mecha, Sci-Fi, Shounen, Space",TV,12,6.47,13827
163,Initial D First Stage,"Action, Cars, Drama, Seinen, Sports",TV,26,8.23,68128
164,Initial D Second Stage,"Action, Cars, Drama, Seinen, Sports",TV,13,8.12,45825
165,Initial D Third Stage,"Action, Cars, Drama, Seinen, Sports",Movie,1,7.98,39374
166,Gosenzo San&#039;e,"Comedy, Hentai, Mystery, Supernatural",OVA,4,6.38,1222
167,Love Hina,"Comedy, Ecchi, Harem, Romance, Shounen, Slice of Life",TV,24,7.28,156627
168,Love Hina Again,"Comedy, Drama, Ecchi, Romance, Shounen",OVA,3,7.36,61154
169,Love Hina Christmas Special: Silent Eve,"Comedy, Romance, Slice of Life",Special,1,7.44,45137
170,Love Hina Haru Special: Kimi Sakura Chiru Nakare!!,"Adventure, Comedy, Romance",Special,1,7.31,40858
171,Maburaho,"Comedy, Drama, Ecchi, Harem, Magic, Romance, School",TV,24,7.01,61004
172,Macross Zero,"Adventure, Mecha, Military, Sci-Fi, Shounen",OVA,5,7.69,23568
173,Onegai☆Teacher,"Comedy, Drama, Romance, School, Sci-Fi",TV,12,7.35,99558
174,Onegai☆Twins,"Comedy, Drama, Harem, School, Sci-Fi",TV,12,7.05,59164
175,Rizelmine,"Comedy, Ecchi, Romance, School, Sci-Fi",TV,24,6.67,16672
176,Speed Grapher,"Action, Mystery, Super Power",TV,24,7.46,64627
177,Sen to Chihiro no Kamikakushi,"Adventure, Drama, Supernatural",Movie,1,8.93,466254
178,Tenshi na Konamaiki,"Comedy, Magic, Romance, Shounen",TV,50,7.6,15077
179,Video Girl Ai,"Comedy, Drama, Ecchi, Romance",OVA,6,7.31,13970
180,Wolf&#039;s Rain,"Action, Adventure, Drama, Fantasy, Mystery, Sci-Fi",TV,26,7.93,171863
181,Words Worth,"Adventure, Demons, Fantasy, Hentai, Magic",OVA,5,6.9,5080
182,Yumeria,"Action, Comedy, Ecchi, Harem, Super Power",TV,12,6.25,19138
183,Samurai Champloo,"Action, Adventure, Comedy, Historical, Samurai, Shounen",TV,26,8.5,390076
184,Lodoss-tou Senki: Eiyuu Kishi Den,"Action, Adventure, Drama, Fantasy, Magic, Romance",TV,27,7.25,16288
185,Lodoss-tou Senki,"Action, Adventure, Fantasy, Magic, Shounen, Supernatural",OVA,13,7.55,28462
186,R.O.D OVA,"Action, Adventure, Historical, Magic, Mystery, Sci-Fi",OVA,3,7.78,41701
187,R.O.D the TV,"Action, Adventure, Comedy, Drama, Sci-Fi, Super Power",TV,26,7.64,47053
188,Ranma ½,"Comedy, Fantasy, Martial Arts, Slice of Life",TV,161,7.87,105212
189,Pure Mail,Hentai,OVA,2,6.37,1911
190,Project A-Ko,"Action, Adventure, Comedy, Mecha, Sci-Fi, Super Power",Movie,1,7.02,7846
191,Pia Carrot e Youkoso!!,"Comedy, Hentai, Romance",OVA,3,6.19,2108
192,Pia Carrot e Youkoso!! 2,"Comedy, Hentai, Romance",OVA,3,6.39,1408
193,Pia Carrot e Youkoso!! 2 DX,"Comedy, Romance",OVA,6,6.52,1425
194,Pia Carrot e Youkoso!!: Sayaka no Koi Monogatari,"Comedy, Romance",Movie,1,6.11,1804
195,Shin Angel,"Comedy, Drama, Hentai, Romance",OVA,5,6.49,1420
196,Kidou Senkan Nadesico,"Action, Comedy, Mecha, Military, Parody, Romance, Sci-Fi, Shounen, Space",TV,26,7.6,27976
197,Kidou Senkan Nadesico: The Prince of Darkness,"Action, Comedy, Drama, Mecha, Psychological, Sci-Fi, Shounen, Space",Movie,1,6.9,9738
198,Kuro no Danshou,"Hentai, Horror",OVA,4,6.05,1388
199,Mezzo Forte,"Action, Comedy, Hentai, Sci-Fi",OVA,2,6.75,14651
200,Mezzo DSA,"Action, Adventure, Comedy, Mystery, Sci-Fi",TV,13,6.78,11750
201,Dragon Ball,"Adventure, Comedy, Fantasy, Martial Arts, Shounen, Super Power",TV,153,8.16,316102
202,Dragon Ball GT,"Action, Adventure, Comedy, Fantasy, Magic, Sci-Fi, Shounen, Super Power",TV,64,6.72,226625
203,Elfen Lied,"Action, Drama, Horror, Psychological, Romance, Seinen, Supernatural",TV,13,7.85,623511
204,FLCL,"Action, Comedy, Dementia, Mecha, Parody, Sci-Fi",OVA,6,8.06,305165
205,Jigoku Shoujo,"Horror, Mystery, Psychological, Supernatural",TV,26,7.79,172415
206,Ninin ga Shinobuden,"Comedy, Martial Arts, Parody",TV,12,7.03,23125
207,Air Master,"Action, Comedy, Martial Arts, Seinen",TV,27,7.14,22433
208,Asagiri no Miko,"Action, Comedy, Drama, Fantasy, Magic, School, Sci-Fi, Shounen, Slice of Life, Super Power, Supernatural",TV,26,6.31,4721
209,Cardcaptor Sakura,"Adventure, Comedy, Drama, Fantasy, Magic, Romance, School, Shoujo",TV,70,8.18,181249
210,Daa! Daa! Daa!,"Comedy, Sci-Fi, Shoujo",TV,78,7.81,12673
211,Dan Doh!!,"Adventure, Shounen, Sports",TV,26,6.82,2351
212,Detective Conan,"Adventure, Comedy, Mystery, Police, Shounen",TV,Unknown,8.25,114702
213,E&#039;s Otherwise,"Adventure, Comedy, Drama, Military, Sci-Fi, Shounen, Supernatural",TV,26,6.75,11704
214,Eureka Seven,"Adventure, Drama, Mecha, Romance, Sci-Fi",TV,50,8.19,239570
215,Rekka no Honoo,"Action, Adventure, Martial Arts, Shounen, Super Power",TV,42,7.44,35258
216,Gankutsuou,"Drama, Mystery, Sci-Fi, Supernatural, Thriller",TV,24,8.27,103828
217,Genshiken,"Comedy, Parody, Slice of Life",TV,12,7.76,104258
218,Girls Bravo: First Season,"Comedy, Ecchi, Fantasy, Harem, Romance, School",TV,11,6.69,84395
219,Gokusen,"Comedy, Drama, Josei, School, Slice of Life",TV,13,7.48,22009
220,Gravitation,"Comedy, Music, Romance, Shoujo, Shounen Ai",TV,13,7.26,67916
221,Agatha Christie no Meitantei Poirot to Marple,"Historical, Mystery",TV,39,6.95,3933
222,Great Teacher Onizuka,"Comedy, Drama, School, Shounen, Slice of Life",TV,43,8.77,268487
223,Groove Adventure Rave,"Adventure, Comedy, Fantasy, Romance, Shounen",TV,51,7.45,56353
224,Harukanaru Toki no Naka de: Hachiyou Shou,"Demons, Fantasy, Historical, Magic, Shoujo, Supernatural",TV,26,7.18,14550
225,Ichigo 100%,"Comedy, Ecchi, Harem, Romance, Shounen",TV,12,6.84,67310
226,InuYasha,"Action, Adventure, Comedy, Demons, Fantasy, Magic, Romance, Shounen, Supernatural",TV,167,7.89,281632
227,Konjiki no Gash Bell!!,"Adventure, Comedy, Magic, Shounen, Supernatural",TV,150,7.66,51403
228,Kyou kara Maou!,"Adventure, Comedy, Demons, Fantasy, Shoujo",TV,78,7.88,58150
229,Madlax,"Drama, Magic, Military, Mystery, Psychological, Shounen, Supernatural",TV,26,7.17,25995
230,Jungle wa Itsumo Hare nochi Guu,"Comedy, School, Slice of Life",TV,26,7.97,22214
231,Jungle wa Itsumo Hare nochi Guu Deluxe,"Comedy, Slice of Life",OVA,6,7.95,8847
232,Jungle wa Itsumo Hare nochi Guu Final,"Comedy, Slice of Life",OVA,7,7.78,7576
233,Hoshi no Koe,"Drama, Mecha, Romance, Sci-Fi, Space",OVA,1,7.53,85492
234,Ikkitousen,"Ecchi, Martial Arts, School, Super Power",TV,13,6.62,88969
235,Hitsuji no Uta,"Drama, Horror, Vampire",OVA,4,6.43,10574
236,Happy☆Lesson,"Comedy, Harem, Romance, School",OVA,5,6.76,8067
237,Happy☆Lesson (TV),"Comedy, Drama, Harem, Romance, Slice of Life",TV,13,6.81,17109
238,Happy☆Lesson: Advance,"Comedy, Harem, Romance, Slice of Life",TV,13,6.97,9989
239,Happy☆Lesson: The Final,"Comedy, Harem, Romance, School",OVA,3,6.96,6371
240,Hajime no Ippo,"Comedy, Drama, Shounen, Sports",TV,75,8.83,157670
241,Hajime no Ippo: Champion Road,"Comedy, Shounen, Sports",Special,1,8.39,47840
242,Hajime no Ippo: Mashiba vs. Kimura,"Comedy, Shounen, Sports",OVA,1,8.28,40623
243,Gunparade March: Arata Naru Kougunka,"Drama, Mecha, Military, Romance, Sci-Fi, Shounen, Slice of Life",TV,12,6.96,9902
244,Gungrave,"Action, Drama, Sci-Fi, Seinen, Super Power",TV,26,7.97,95825
245,Golden Boy,"Adventure, Comedy, Ecchi",OVA,6,8.05,113040
246,Bleach,"Action, Comedy, Shounen, Super Power, Supernatural",TV,366,7.95,624055
247,Hellsing,"Action, Horror, Seinen, Supernatural, Vampire",TV,13,7.64,308995
248,Gad Guard,"Adventure, Mecha, Sci-Fi, Shounen",TV,26,6.82,8315
249,Noir,"Action, Drama, Mystery",TV,26,7.41,66036
250,Mahoutsukai ni Taisetsu na Koto,"Drama, Magic, Shounen, Slice of Life",TV,12,6.87,15152
251,Kiddy Grade,"Action, Ecchi, Mecha, Sci-Fi, Super Power",TV,24,7.31,30766
252,Love♥Love?,"Comedy, Ecchi, Harem, Romance",TV,9,6.05,15114
253,Mahoromatic: Automatic Maiden,"Comedy, Ecchi, Military, Romance, Sci-Fi",TV,12,7.29,36656
254,Mahoromatic 2,"Comedy, Drama, Ecchi, Military, Romance, Sci-Fi",TV,14,7.3,21393
255,Viewtiful Joe,"Action, Comedy, Sci-Fi, Shounen",TV,51,6.92,5420
256,Kyougoku Natsuhiko: Kousetsu Hyaku Monogatari,"Fantasy, Historical, Horror, Mystery, Psychological, Supernatural",TV,13,7.27,20859
257,Animal Yokochou,"Adventure, Comedy, Fantasy, Shoujo",TV,51,7.04,1511
258,Akane Maniax,"Comedy, Mecha, Romance",OVA,3,5.83,13988
259,Angel Heart,"Action, Drama, Mystery, Romance, Seinen",TV,50,7.38,9550
260,Akage no Anne,"Drama, Historical, Slice of Life",TV,50,7.6,9460
261,Area 88 (TV),"Action, Drama, Military, Romance, Shounen",TV,12,7.17,7563
262,Argento Soma,"Action, Adventure, Drama, Mecha, Military, Sci-Fi",TV,25,6.94,12809
263,B&#039;T X,"Adventure, Mecha, Sci-Fi, Shounen",TV,25,7.17,5913
264,Grappler Baki (TV),"Shounen, Sports",TV,24,7.41,23220
265,Bakuten Shoot Beyblade,"Action, Adventure, Comedy, Sci-Fi, Shounen, Sports",TV,51,6.81,49467
266,Comic Party,"Comedy, Drama",TV,13,6.68,12988
267,Seikai no Monshou,"Action, Military, Romance, Sci-Fi, Space",TV,13,7.83,26379
268,D.C.S.S: Da Capo Second Season,"Comedy, Drama, Harem, Romance, Supernatural",TV,26,7.15,23364
269,Dear Boys,"Drama, Shounen, Sports",TV,26,6.99,12662
270,Di Gi Charat,"Comedy, Fantasy, Sci-Fi",TV,16,6.85,12227
271,Divergence Eve,"Adventure, Comedy, Drama, Mecha, Military, Sci-Fi, Space",TV,13,6.08,7833
272,Divergence Eve 2: Misaki Chronicles,"Adventure, Drama, Mecha, Military, Sci-Fi, Space",TV,13,6.43,4790
273,Dragon Drive,"Action, Adventure, Comedy, Fantasy, School, Sci-Fi, Shounen",TV,38,6.88,14232
274,Grenadier: Hohoemi no Senshi,"Action, Adventure, Comedy, Ecchi, Shounen",TV,12,6.83,37919
275,.hack//Tasogare no Udewa Densetsu,"Adventure, Comedy, Fantasy, Game, Sci-Fi, Shounen",TV,12,6.75,47679
276,.hack//Liminality,"Game, Mystery, Sci-Fi",OVA,4,6.74,24304
277,3x3 Eyes,"Action, Demons, Fantasy, Horror, Romance",OVA,4,6.97,15683
278,Cinderella Boy,"Action, Adventure, Comedy, Mystery",TV,13,6.38,3246
279,Mirai Shounen Conan,"Adventure, Drama, Sci-Fi",TV,26,8.16,15557
280,Aa! Megami-sama!: Chichaitte Koto wa Benri da ne,"Comedy, Magic, Supernatural",TV,48,7.04,15937
281,Aa! Megami-sama! Movie,"Comedy, Magic, Romance, Seinen, Supernatural",Movie,1,7.65,29330
282,Abashiri Ikka,"Action, Comedy, Shounen",OVA,4,5.64,2000
283,Abenobashi Mahou☆Shoutengai,"Comedy, Ecchi, Fantasy, Parody",TV,13,7.38,47752
284,Kerokko Demetan,"Comedy, Fantasy, Kids",TV,39,6.04,533
285,Zettai Shounen,"Drama, Fantasy, Mystery, Sci-Fi, Shounen",TV,26,7.06,11165
286,Akahori Gedou Hour Rabuge,"Comedy, Magic, Parody",TV,13,6.3,3271
287,"Chiisana Obake Acchi, Kocchi, Socchi","Comedy, Supernatural",TV,50,6.17,1226
288,Ace wo Nerae!,"Drama, Romance, School, Shoujo, Sports",TV,26,7.08,3945
289,Ace wo Nerae!: Final Stage,"Action, Drama, Sports",OVA,12,6.61,714
290,Ace wo Nerae! (1979),"Drama, Romance, School, Shoujo, Sports",Movie,1,6.95,1564
291,Ace wo Nerae! 2,"Drama, Shoujo, Sports",OVA,13,6.81,890
292,Xiao Qian,"Action, Drama, Fantasy, Romance",Movie,1,6.76,1823
293,Nageki no Kenkou Yuuryouji,"Comedy, Hentai, Yuri",OVA,3,6.4,2594
294,Final Fantasy VII: Advent Children,"Action, Fantasy, Super Power",Movie,1,7.94,138659
295,Hand Maid May,"Comedy, Ecchi, Harem, Romance, Sci-Fi",TV,10,6.85,17895
296,Happy World!,"Comedy, Ecchi, Fantasy, Romance",OVA,3,6.11,4348
297,A Kite,"Action, Drama, Hentai, Police",OVA,2,6.72,27941
298,Najica Dengeki Sakusen,"Action, Comedy, Ecchi, Sci-Fi",TV,12,6.08,9605
299,Paradise Kiss,"Comedy, Drama, Josei, Romance, Slice of Life",TV,12,7.93,86380
300,Mousou Dairinin,"Drama, Mystery, Police, Psychological, Supernatural, Thriller",TV,13,7.74,137687
301,Mobile Police Patlabor: On Television,"Comedy, Mecha, Police, Sci-Fi",TV,47,7.72,16130
302,Peach Girl,"Drama, Romance, Shoujo, Slice of Life",TV,25,7.16,49508
